{
    "Brazil": [{
        "name": "Fernando Collor de Mello",
        "href": "http://www.worldpresidentsdb.com/Fernando-Collor-de-Mello/",
        "rawTerms": [" 1990-03-15 to 1992-10-02"],
        "titleName": "President Fernando Collor de Mello",
        "terms": [["1990-03-15", "1992-10-02"]]
    }, {
        "name": "Itamar Franco",
        "href": "http://www.worldpresidentsdb.com/Itamar-Franco/",
        "rawTerms": ["12/29/1992 to 01/01/1995"],
        "titleName": "President Itamar Franco",
        "terms": [["1992-12-29", "1995-01-01"]]
    }, {
        "name": "Fernando Henrique Cardoso",
        "href": "http://www.worldpresidentsdb.com/Fernando-Henrique-Cardoso/",
        "rawTerms": [" 1995-01-01 to 1999-01-01", " 1999-01-01 to 2003-01-01"],
        "titleName": "President Fernando Henrique Cardoso",
        "terms": [["1995-01-01", "1999-01-01"], ["1999-01-01", "2003-01-01"]]
    }, {
        "name": "Luiz Inacio Lula da Silva",
        "href": "http://www.worldpresidentsdb.com/Luiz-Inacio-Lula-da-Silva/",
        "rawTerms": [" 2003-01-01 to 2007-01-01", " 2007-01-01 to 2011-01-01"],
        "titleName": "President Luiz Inacio Lula da Silva",
        "terms": [["2003-01-01", "2007-01-01"], ["2007-01-01", "2011-01-01"]]
    }, {
        "name": "Dilma Rousseff",
        "href": "http://www.worldpresidentsdb.com/Dilma-Rousseff/",
        "rawTerms": [" In office since 2011-01-01"],
        "titleName": "President Dilma Rousseff",
        "terms": [["2011-01-01", null]]
    }],
    "Afghanistan": [{
        "name": "Mohammad Najibullah",
        "href": "http://www.worldpresidentsdb.com/Mohammad-Najibullah/",
        "rawTerms": [" 1987-09-30 to 1992-04-16"],
        "titleName": "President Mohammad Najibullah",
        "terms": [["1987-09-30", "1992-04-16"]]
    }, {
        "name": "Burhanuddin Rabbani",
        "href": "http://www.worldpresidentsdb.com/Burhanuddin-Rabbani/",
        "rawTerms": [" 2001-11-13 to 2001-12-22", " 1922-06-28 to 1996-09-27"],
        "titleName": "President Burhanuddin Rabbani",
        "terms": [["2001-11-13", "2001-12-22"], ["1922-06-28", "1996-09-27"]]
    }, {
        "name": "Hamid Karzai",
        "href": "http://www.worldpresidentsdb.com/Hamid-Karzai/",
        "rawTerms": [" 2009-08-20 to 2014-09-29", " 2001-12-22 to 2004-12-07"],
        "titleName": "Dictator Hamid Karzai",
        "terms": [["2009-08-20", "2014-09-29"], ["2001-12-22", "2004-12-07"]]
    }, {
        "name": "Ashraf Ghani",
        "href": "http://www.worldpresidentsdb.com/Ashraf-Ghani/",
        "rawTerms": [" In office since 2014-09-29"],
        "titleName": "President Ashraf Ghani",
        "terms": [["2014-09-29", null]]
    }],
    "Dominican-Republic": [{
        "name": "Hipolito Mejia",
        "href": "http://www.worldpresidentsdb.com/Hipolito-Mejia/",
        "rawTerms": [" 2000-08-16 to 2004-08-16"],
        "titleName": "President Hipolito Mejia",
        "terms": [["2000-08-16", "2004-08-16"]]
    }, {
        "name": "Leonel Fernandez",
        "href": "http://www.worldpresidentsdb.com/Leonel-Fernandez/",
        "rawTerms": [" 2004-08-16 to 2012-08-16", " 1996-08-16 to 2000-08-16"],
        "titleName": "President Leonel Fernandez",
        "terms": [["2004-08-16", "2012-08-16"], ["1996-08-16", "2000-08-16"]]
    }, {
        "name": "Danilo Medina",
        "href": "http://www.worldpresidentsdb.com/Danilo-Medina/",
        "rawTerms": [" In office since 2012-08-16"],
        "titleName": "President Danilo Medina",
        "terms": [["2012-08-16", null]]
    }],
    "Italy": [{
        "name": "Carlo Azeglio Ciampi",
        "href": "http://www.worldpresidentsdb.com/Carlo-Azeglio-Ciampi/",
        "rawTerms": [" 1999-05-18 to 2006-05-15"],
        "titleName": "President Carlo Azeglio Ciampi",
        "terms": [["1999-05-18", "2006-05-15"]]
    }, {
        "name": "Francesco Cossiga",
        "href": "http://www.worldpresidentsdb.com/Francesco-Cossiga/",
        "rawTerms": [" 1985-06-29 to 1992-04-28"],
        "titleName": "President Francesco Cossiga",
        "terms": [["1985-06-29", "1992-04-28"]]
    }, {
        "name": "Enrico De Nicola",
        "href": "http://www.worldpresidentsdb.com/Enrico-De-Nicola/",
        "rawTerms": [" 1946-07-01 to 1948-05-11"],
        "titleName": "President Enrico De Nicola",
        "terms": [["1946-07-01", "1948-05-11"]]
    }, {
        "name": "Luigi Einaudi",
        "href": "http://www.worldpresidentsdb.com/Luigi-Einaudi/",
        "rawTerms": [" 1948-05-11 to 1955-05-11"],
        "titleName": "President Luigi Einaudi",
        "terms": [["1948-05-11", "1955-05-11"]]
    }, {
        "name": "Giovanni Gronchi",
        "href": "http://www.worldpresidentsdb.com/Giovanni-Gronchi/",
        "rawTerms": [" 1955-05-11 to 1962-05-11"],
        "titleName": "President Giovanni Gronchi",
        "terms": [["1955-05-11", "1962-05-11"]]
    }, {
        "name": "Enrico Letta",
        "href": "http://www.worldpresidentsdb.com/Enrico-Letta/",
        "rawTerms": [" 2013-04-28 to 2014-02-22"],
        "titleName": "Prime Minister Enrico Letta",
        "terms": [["2013-04-28", "2014-02-22"]]
    }, {
        "name": "Mario Monti",
        "href": "http://www.worldpresidentsdb.com/Mario-Monti/",
        "rawTerms": [" 2011-11-16 to 2013-04-28"],
        "titleName": "Prime Minister Mario Monti",
        "terms": [["2011-11-16", "2013-04-28"]]
    }, {
        "name": "Benito Mussolini",
        "href": "http://www.worldpresidentsdb.com/Benito-Mussolini/",
        "rawTerms": ["10/31/1922 to 07/25/1943"],
        "titleName": "Prime Minister Benito Mussolini",
        "terms": [["1922-10-31", "1943-07-25"]]
    }, {
        "name": "Giorgio Napolitano",
        "href": "http://www.worldpresidentsdb.com/Giorgio-Napolitano/",
        "rawTerms": [" In office since 2006-05-15"],
        "titleName": "President Giorgio Napolitano",
        "terms": [["2006-05-15", null]]
    }, {
        "name": "Matteo Renzi",
        "href": "http://www.worldpresidentsdb.com/Matteo-Renzi/",
        "rawTerms": [" In office since 2014-02-22"],
        "titleName": "Prime Minister Matteo Renzi",
        "terms": [["2014-02-22", null]]
    }, {
        "name": "Oscar Luigi Scalfaro",
        "href": "http://www.worldpresidentsdb.com/Oscar-Luigi-Scalfaro/",
        "rawTerms": ["05/25/1992 to 05/15/1999"],
        "titleName": "President Oscar Luigi Scalfaro",
        "terms": [["1992-05-25", "1999-05-15"]]
    }],
    "Bangladesh": [{
        "name": "AFM Ahsanuddin Chowdhury",
        "href": "http://www.worldpresidentsdb.com/AFM-Ahsanuddin-Chowdhury/",
        "rawTerms": [" 1982-03-27 to 1983-12-10"],
        "titleName": "President AFM Ahsanuddin Chowdhury",
        "terms": [["1982-03-27", "1983-12-10"]]
    }, {
        "name": "Hussain Muhammad Ershad",
        "href": "http://www.worldpresidentsdb.com/Hussain-Muhammad-Ershad/",
        "rawTerms": [" 1983-12-11 to 1990-12-06"],
        "titleName": "President Hussain Muhammad Ershad",
        "terms": [["1983-12-11", "1990-12-06"]]
    }, {
        "name": "Zillur Rahman",
        "href": "http://www.worldpresidentsdb.com/Zillur-Rahman/",
        "rawTerms": [" 2009-02-12 to 2013-03-20"],
        "titleName": "President Zillur Rahman",
        "terms": [["2009-02-12", "2013-03-20"]]
    }, {
        "name": "Abdul Hamid",
        "href": "http://www.worldpresidentsdb.com/Abdul-Hamid/",
        "rawTerms": [" In office since 2013-04-24"],
        "titleName": "President Abdul Hamid",
        "terms": [["2013-04-24", null]]
    }],
    "Canada": [{
        "name": "John A Macdonald",
        "href": "http://www.worldpresidentsdb.com/John-A-Macdonald/",
        "rawTerms": [" 1878-10-17 to 1891-06-06"],
        "titleName": "Prime Minister John A Macdonald",
        "terms": [["1878-10-17", "1891-06-06"]]
    }, {
        "name": "Alexander Mackenzie",
        "href": "http://www.worldpresidentsdb.com/Alexander-Mackenzie/",
        "rawTerms": [" 1873-11-07 to 1878-10-08"],
        "titleName": "Prime Minister Alexander Mackenzie",
        "terms": [["1873-11-07", "1878-10-08"]]
    }, {
        "name": "John Abbott",
        "href": "http://www.worldpresidentsdb.com/John-Abbott/",
        "rawTerms": [" 1891-06-16 to 1892-11-24"],
        "titleName": "Prime Minister John Abbott",
        "terms": [["1891-06-16", "1892-11-24"]]
    }, {
        "name": "John Sparrow David Thompson",
        "href": "http://www.worldpresidentsdb.com/John-Sparrow-David-Thompson/",
        "rawTerms": [" 1892-12-05 to 1894-12-12"],
        "titleName": "Prime Minister John Sparrow David Thompson",
        "terms": [["1892-12-05", "1894-12-12"]]
    }, {
        "name": "Mackenzie Bowell",
        "href": "http://www.worldpresidentsdb.com/Mackenzie-Bowell/",
        "rawTerms": [" 1894-12-21 to 1896-04-27"],
        "titleName": "Prime Minister Mackenzie Bowell",
        "terms": [["1894-12-21", "1896-04-27"]]
    }, {
        "name": "Charles Tupper",
        "href": "http://www.worldpresidentsdb.com/Charles-Tupper/",
        "rawTerms": [" 1896-05-01 to 1896-07-08"],
        "titleName": "Prime Minister Charles Tupper",
        "terms": [["1896-05-01", "1896-07-08"]]
    }, {
        "name": "Wilfrid Laurier",
        "href": "http://www.worldpresidentsdb.com/Wilfrid-Laurier/",
        "rawTerms": [" 1896-07-11 to 1911-10-06"],
        "titleName": "Prime Minister Wilfrid Laurier",
        "terms": [["1896-07-11", "1911-10-06"]]
    }, {
        "name": "Robert Borden",
        "href": "http://www.worldpresidentsdb.com/Robert-Borden/",
        "rawTerms": [" 1911-10-10 to 1920-07-10"],
        "titleName": "Prime Minister Robert Borden",
        "terms": [["1911-10-10", "1920-07-10"]]
    }, {
        "name": "Arthur Meighen",
        "href": "http://www.worldpresidentsdb.com/Arthur-Meighen/",
        "rawTerms": [" 1926-06-29 to 1926-09-25"],
        "titleName": "Prime Minister Arthur Meighen",
        "terms": [["1926-06-29", "1926-09-25"]]
    }, {
        "name": "William Lyon Mackenzie King",
        "href": "http://www.worldpresidentsdb.com/William-Lyon-Mackenzie-King/",
        "rawTerms": [" 1921-12-29 to 1926-06-28"],
        "titleName": "Prime Minister William Lyon Mackenzie King",
        "terms": [["1921-12-29", "1926-06-28"]]
    }, {
        "name": "Richard Bedford Bennett",
        "href": "http://www.worldpresidentsdb.com/Richard-Bedford-Bennett/",
        "rawTerms": [" 1930-08-07 to 1935-10-23"],
        "titleName": "Prime Minister Richard Bedford Bennett",
        "terms": [["1930-08-07", "1935-10-23"]]
    }, {
        "name": "Louis St Laurent",
        "href": "http://www.worldpresidentsdb.com/Louis-St-Laurent/",
        "rawTerms": [" 1948-11-15 to 1957-06-21"],
        "titleName": "Prime Minister Louis St Laurent",
        "terms": [["1948-11-15", "1957-06-21"]]
    }, {
        "name": "John Diefenbaker",
        "href": "http://www.worldpresidentsdb.com/John-Diefenbaker/",
        "rawTerms": [" 1957-06-21 to 1963-04-22"],
        "titleName": "Prime Minister John Diefenbaker",
        "terms": [["1957-06-21", "1963-04-22"]]
    }, {
        "name": "Lester B Pearson",
        "href": "http://www.worldpresidentsdb.com/Lester-B-Pearson/",
        "rawTerms": [" 1963-04-22 to 1968-04-20"],
        "titleName": "Prime Minister Lester B Pearson",
        "terms": [["1963-04-22", "1968-04-20"]]
    }, {
        "name": "Pierre Trudeau",
        "href": "http://www.worldpresidentsdb.com/Pierre-Trudeau/",
        "rawTerms": ["04/20/1968 to 06/04/1979\r\n03/03/1980 to 06/30/1984"],
        "titleName": "Prime Minister Pierre Trudeau",
        "terms": [["1968-04-20", "1979-06-04"]]
    }, {
        "name": "Joe Clark",
        "href": "http://www.worldpresidentsdb.com/Joe-Clark/",
        "rawTerms": [" 1979-06-04 to 1980-03-03"],
        "titleName": "Prime Minister Joe Clark",
        "terms": [["1979-06-04", "1980-03-03"]]
    }, {
        "name": "John Turner",
        "href": "http://www.worldpresidentsdb.com/John-Turner/",
        "rawTerms": ["06/30/1984 to 09/17/1984"],
        "titleName": "Prime Minister John Turner",
        "terms": [["1984-06-30", "1984-09-17"]]
    }, {
        "name": "Brian Mulroney",
        "href": "http://www.worldpresidentsdb.com/Brian-Mulroney/",
        "rawTerms": ["09/17/1984 to 06/25/1993"],
        "titleName": "Prime Minister Brian Mulroney",
        "terms": [["1984-09-17", "1993-06-25"]]
    }, {
        "name": "Kim Campbell",
        "href": "http://www.worldpresidentsdb.com/Kim-Campbell/",
        "rawTerms": [" 1993-06-25 to 1993-11-04"],
        "titleName": "Prime Minister Kim Campbell",
        "terms": [["1993-06-25", "1993-11-04"]]
    }, {
        "name": "Jean Chretien",
        "href": "http://www.worldpresidentsdb.com/Jean-Chretien/",
        "rawTerms": ["11/04/1993 to 12/12/2003"],
        "titleName": "Prime Minister Jean Chretien",
        "terms": [["1993-11-04", "2003-12-12"]]
    }, {
        "name": "Paul Martin",
        "href": "http://www.worldpresidentsdb.com/Paul-Martin/",
        "rawTerms": [" 2003-12-12 to 2006-02-06"],
        "titleName": "Prime Minister Paul Martin",
        "terms": [["2003-12-12", "2006-02-06"]]
    }, {
        "name": "Stephen Harper",
        "href": "http://www.worldpresidentsdb.com/Stephen-Harper/",
        "rawTerms": [" In office since 2006-02-06"],
        "titleName": "Prime Minister Stephen Harper",
        "terms": [["2006-02-06", null]]
    }],
    "Kenya": [{
        "name": "Jomo Kenyatta",
        "href": "http://www.worldpresidentsdb.com/Jomo-Kenyatta/",
        "rawTerms": [" 1964-12-12 to 1978-08-22"],
        "titleName": "President Jomo Kenyatta",
        "terms": [["1964-12-12", "1978-08-22"]]
    }, {
        "name": "Daniel arap Moi",
        "href": "http://www.worldpresidentsdb.com/Daniel-arap-Moi/",
        "rawTerms": [" 1978-08-22 to 2002-12-30"],
        "titleName": "President Daniel arap Moi",
        "terms": [["1978-08-22", "2002-12-30"]]
    }, {
        "name": "Mwai Kibaki",
        "href": "http://www.worldpresidentsdb.com/Mwai-Kibaki/",
        "rawTerms": [" 2002-12-30 to 2013-04-09"],
        "titleName": "President Mwai Kibaki",
        "terms": [["2002-12-30", "2013-04-09"]]
    }, {
        "name": "Uhuru Kenyatta",
        "href": "http://www.worldpresidentsdb.com/Uhuru-Kenyatta/",
        "rawTerms": [" In office since 2013-04-09"],
        "titleName": "President Uhuru Kenyatta",
        "terms": [["2013-04-09", null]]
    }],
    "United-Kingdom": [{
        "name": "Robert Walpole",
        "href": "http://www.worldpresidentsdb.com/Robert-Walpole/",
        "rawTerms": [" 1721-04-04 to 1742-02-11"],
        "titleName": "Prime Minister Robert Walpole",
        "terms": [["1721-04-04", "1742-02-11"]]
    }, {
        "name": "Spencer Compton",
        "href": "http://www.worldpresidentsdb.com/Spencer-Compton/",
        "rawTerms": [" 1742-02-16 to 1743-07-02"],
        "titleName": "Prime Minister Spencer Compton",
        "terms": [["1742-02-16", "1743-07-02"]]
    }, {
        "name": "Henry Pelham",
        "href": "http://www.worldpresidentsdb.com/Henry-Pelham/",
        "rawTerms": [" 1743-08-27 to 1754-03-06"],
        "titleName": "Prime Minister Henry Pelham",
        "terms": [["1743-08-27", "1754-03-06"]]
    }, {
        "name": "Thomas Pelham Holles",
        "href": "http://www.worldpresidentsdb.com/Thomas-Pelham-Holles/",
        "rawTerms": [" 1757-07-02 to 1762-05-26", " 1754-03-16 to 1756-11-16"],
        "titleName": "Prime Minister Thomas Pelham Holles",
        "terms": [["1757-07-02", "1762-05-26"], ["1754-03-16", "1756-11-16"]]
    }, {
        "name": "William Cavendish",
        "href": "http://www.worldpresidentsdb.com/William-Cavendish/",
        "rawTerms": [" 1756-11-16 to 1757-06-25"],
        "titleName": "Prime Minister William Cavendish",
        "terms": [["1756-11-16", "1757-06-25"]]
    }, {
        "name": "John Stuart",
        "href": "http://www.worldpresidentsdb.com/John-Stuart/",
        "rawTerms": [" 1762-05-26 to 1763-04-08"],
        "titleName": "Prime Minister John Stuart",
        "terms": [["1762-05-26", "1763-04-08"]]
    }, {
        "name": "George Grenville",
        "href": "http://www.worldpresidentsdb.com/George-Grenville/",
        "rawTerms": [" 1763-04-16 to 1765-07-13"],
        "titleName": "Prime Minister George Grenville",
        "terms": [["1763-04-16", "1765-07-13"]]
    }, {
        "name": "Charles Watson Wentworth",
        "href": "http://www.worldpresidentsdb.com/Charles-Watson-Wentworth/",
        "rawTerms": [" 1782-03-27 to 1782-07-01"],
        "titleName": "Prime Minister Charles Watson Wentworth",
        "terms": [["1782-03-27", "1782-07-01"]]
    }, {
        "name": "William Pitt the Elder",
        "href": "http://www.worldpresidentsdb.com/William-Pitt-the-Elder/",
        "rawTerms": [" 1766-07-30 to 1768-10-14"],
        "titleName": "Prime Minister William Pitt the Elder",
        "terms": [["1766-07-30", "1768-10-14"]]
    }, {
        "name": "Augustus FitzRoy",
        "href": "http://www.worldpresidentsdb.com/Augustus-FitzRoy/",
        "rawTerms": [" 1768-10-14 to 1770-01-28"],
        "titleName": "Prime Minister Augustus FitzRoy",
        "terms": [["1768-10-14", "1770-01-28"]]
    }, {
        "name": "Lord Frederick North",
        "href": "http://www.worldpresidentsdb.com/Lord-Frederick-North/",
        "rawTerms": [" 1770-01-28 to 1782-03-22"],
        "titleName": "Prime Minister Lord Frederick North",
        "terms": [["1770-01-28", "1782-03-22"]]
    }, {
        "name": "William Petty",
        "href": "http://www.worldpresidentsdb.com/William-Petty/",
        "rawTerms": [" 1782-07-04 to 1783-04-02"],
        "titleName": "Prime Minister William Petty",
        "terms": [["1782-07-04", "1783-04-02"]]
    }, {
        "name": "William Cavendish Bentinck",
        "href": "http://www.worldpresidentsdb.com/William-Cavendish-Bentinck/",
        "rawTerms": [" 1807-03-31 to 1809-10-04", " 1783-04-02 to 1783-12-19"],
        "titleName": "Prime Minister William Cavendish Bentinck",
        "terms": [["1807-03-31", "1809-10-04"], ["1783-04-02", "1783-12-19"]]
    }, {
        "name": "William Pitt",
        "href": "http://www.worldpresidentsdb.com/William-Pitt/",
        "rawTerms": [" 1804-05-10 to 1806-01-23", " 1783-12-19 to 1801-03-14"],
        "titleName": "Prime Minister William Pitt",
        "terms": [["1804-05-10", "1806-01-23"], ["1783-12-19", "1801-03-14"]]
    }, {
        "name": "Henry Addington",
        "href": "http://www.worldpresidentsdb.com/Henry-Addington/",
        "rawTerms": [" 1801-03-14 to 1804-05-10"],
        "titleName": "Prime Minister Henry Addington",
        "terms": [["1801-03-14", "1804-05-10"]]
    }, {
        "name": "William Grenville",
        "href": "http://www.worldpresidentsdb.com/William-Grenville/",
        "rawTerms": [" 1806-02-11 to 1807-03-31"],
        "titleName": "Prime Minister William Grenville",
        "terms": [["1806-02-11", "1807-03-31"]]
    }, {
        "name": "Spencer Perceval",
        "href": "http://www.worldpresidentsdb.com/Spencer-Perceval/",
        "rawTerms": [" 1809-10-04 to 1812-05-11"],
        "titleName": "Prime Minister Spencer Perceval",
        "terms": [["1809-10-04", "1812-05-11"]]
    }, {
        "name": "Robert Jenkinson",
        "href": "http://www.worldpresidentsdb.com/Robert-Jenkinson/",
        "rawTerms": [" 1812-06-08 to 1827-04-09"],
        "titleName": "Prime Minister Robert Jenkinson",
        "terms": [["1812-06-08", "1827-04-09"]]
    }, {
        "name": "George Canning",
        "href": "http://www.worldpresidentsdb.com/George-Canning/",
        "rawTerms": [" 1827-04-10 to 1827-08-08"],
        "titleName": "Prime Minister George Canning",
        "terms": [["1827-04-10", "1827-08-08"]]
    }, {
        "name": "Frederick Robinson",
        "href": "http://www.worldpresidentsdb.com/Frederick-Robinson/",
        "rawTerms": [" 1827-08-31 to 1828-01-21"],
        "titleName": "Prime Minister Frederick Robinson",
        "terms": [["1827-08-31", "1828-01-21"]]
    }, {
        "name": "Arthur Wellesley",
        "href": "http://www.worldpresidentsdb.com/Arthur-Wellesley/",
        "rawTerms": [" 1828-01-22 to 1830-11-16", " 1834-11-14 to 1834-12-10"],
        "titleName": "Prime Minister Arthur Wellesley",
        "terms": [["1828-01-22", "1830-11-16"], ["1834-11-14", "1834-12-10"]]
    }, {
        "name": "Charles Grey",
        "href": "http://www.worldpresidentsdb.com/Charles-Grey/",
        "rawTerms": [" 1830-11-22 to 1834-07-16"],
        "titleName": "Prime Minister Charles Grey",
        "terms": [["1830-11-22", "1834-07-16"]]
    }, {
        "name": "William Lamb",
        "href": "http://www.worldpresidentsdb.com/William-Lamb/",
        "rawTerms": [" 1834-07-16 to 1834-11-14", " 1835-04-18 to 1841-08-30"],
        "titleName": "Prime Minister William Lamb",
        "terms": [["1834-07-16", "1834-11-14"], ["1835-04-18", "1841-08-30"]]
    }, {
        "name": "Robert Peel",
        "href": "http://www.worldpresidentsdb.com/Robert-Peel/",
        "rawTerms": [" 1841-08-30 to 1846-06-29", " 1834-12-10 to 1835-04-08"],
        "titleName": "Prime Minister Robert Peel",
        "terms": [["1841-08-30", "1846-06-29"], ["1834-12-10", "1835-04-08"]]
    }, {
        "name": "John Russell",
        "href": "http://www.worldpresidentsdb.com/John-Russell/",
        "rawTerms": [" 1865-10-29 to 1866-06-28", " 1846-06-30 to 1852-02-23"],
        "titleName": "Prime Minister John Russell",
        "terms": [["1865-10-29", "1866-06-28"], ["1846-06-30", "1852-02-23"]]
    }, {
        "name": "Edward Smith Stanley",
        "href": "http://www.worldpresidentsdb.com/Edward-Smith-Stanley/",
        "rawTerms": [" 1866-06-28 to 1868-02-27", " 1858-02-20 to 1859-06-11", " 1852-02-23 to 1852-12-19"],
        "titleName": "Prime Minister Edward Smith Stanley",
        "terms": [["1866-06-28", "1868-02-27"], ["1858-02-20", "1859-06-11"], ["1852-02-23", "1852-12-19"]]
    }, {
        "name": "George Hamilton Gordon",
        "href": "http://www.worldpresidentsdb.com/George-Hamilton-Gordon/",
        "rawTerms": [" 1852-12-19 to 1855-01-30"],
        "titleName": "Prime Minister George Hamilton Gordon",
        "terms": [["1852-12-19", "1855-01-30"]]
    }, {
        "name": "Henry John Temple",
        "href": "http://www.worldpresidentsdb.com/Henry-John-Temple/",
        "rawTerms": [" 1859-06-12 to 1865-10-18", " 1855-02-06 to 1858-02-19"],
        "titleName": "Prime Minister Henry John Temple",
        "terms": [["1859-06-12", "1865-10-18"], ["1855-02-06", "1858-02-19"]]
    }, {
        "name": "Benjamin Disraeli",
        "href": "http://www.worldpresidentsdb.com/Benjamin-Disraeli/",
        "rawTerms": [" 1874-02-20 to 1880-04-21", " 1868-02-27 to 1868-12-01"],
        "titleName": "Prime Minister Benjamin Disraeli",
        "terms": [["1874-02-20", "1880-04-21"], ["1868-02-27", "1868-12-01"]]
    }, {
        "name": "William Ewart Gladstone",
        "href": "http://www.worldpresidentsdb.com/William-Ewart-Gladstone/",
        "rawTerms": [" 1892-08-15 to 1894-03-02", " 1886-02-01 to 1886-07-20", " 1880-04-23 to 1885-06-09", " 1868-12-03 to 1874-02-17"],
        "titleName": "Prime Minister William Ewart Gladstone",
        "terms": [["1892-08-15", "1894-03-02"], ["1886-02-01", "1886-07-20"], ["1880-04-23", "1885-06-09"], ["1868-12-03", "1874-02-17"]]
    }, {
        "name": "Robert Gascoyne Cecil",
        "href": "http://www.worldpresidentsdb.com/Robert-Gascoyne-Cecil/",
        "rawTerms": [" 1885-06-23 to 1886-01-28", " 1886-07-25 to 1892-08-11", " 1895-06-25 to 1902-07-11"],
        "titleName": "Prime Minister Robert Gascoyne Cecil",
        "terms": [["1885-06-23", "1886-01-28"], ["1886-07-25", "1892-08-11"], ["1895-06-25", "1902-07-11"]]
    }, {
        "name": "Archibald Primrose",
        "href": "http://www.worldpresidentsdb.com/Archibald-Primrose/",
        "rawTerms": [" 1894-03-05 to 1895-06-22"],
        "titleName": "Prime Minister Archibald Primrose",
        "terms": [["1894-03-05", "1895-06-22"]]
    }, {
        "name": "Arthur Balfour",
        "href": "http://www.worldpresidentsdb.com/Arthur-Balfour/",
        "rawTerms": [" 1902-07-11 to 1905-12-05"],
        "titleName": "Prime Minister Arthur Balfour",
        "terms": [["1902-07-11", "1905-12-05"]]
    }, {
        "name": "Henry Campbell Bannerman",
        "href": "http://www.worldpresidentsdb.com/Henry-Campbell-Bannerman/",
        "rawTerms": [" 1905-12-05 to 1908-04-03"],
        "titleName": "Prime Minister Henry Campbell Bannerman",
        "terms": [["1905-12-05", "1908-04-03"]]
    }, {
        "name": "Herbert Henry Asquith",
        "href": "http://www.worldpresidentsdb.com/Herbert-Henry-Asquith/",
        "rawTerms": [" 1908-04-05 to 1916-12-05"],
        "titleName": "Prime Minister Herbert Henry Asquith",
        "terms": [["1908-04-05", "1916-12-05"]]
    }, {
        "name": "David Lloyd George",
        "href": "http://www.worldpresidentsdb.com/David-Lloyd-George/",
        "rawTerms": [" 1916-12-07 to 1922-10-22"],
        "titleName": "Prime Minister David Lloyd George",
        "terms": [["1916-12-07", "1922-10-22"]]
    }, {
        "name": "Bonar Law",
        "href": "http://www.worldpresidentsdb.com/Bonar-Law/",
        "rawTerms": [" 1922-10-23 to 1923-05-22"],
        "titleName": "Prime Minister Bonar Law",
        "terms": [["1922-10-23", "1923-05-22"]]
    }, {
        "name": "Stanley Baldwin",
        "href": "http://www.worldpresidentsdb.com/Stanley-Baldwin/",
        "rawTerms": [" 1935-06-07 to 1937-05-28", " 1924-11-04 to 1929-06-05", " 1923-05-23 to 1924-01-16"],
        "titleName": "Prime Minister Stanley Baldwin",
        "terms": [["1935-06-07", "1937-05-28"], ["1924-11-04", "1929-06-05"], ["1923-05-23", "1924-01-16"]]
    }, {
        "name": "Ramsay MacDonald",
        "href": "http://www.worldpresidentsdb.com/Ramsay-MacDonald/",
        "rawTerms": [" 1929-06-05 to 1935-06-07", " 1924-01-22 to 1924-11-04"],
        "titleName": "Prime Minister Ramsay MacDonald",
        "terms": [["1929-06-05", "1935-06-07"], ["1924-01-22", "1924-11-04"]]
    }, {
        "name": "Neville Chamberlain",
        "href": "http://www.worldpresidentsdb.com/Neville-Chamberlain/",
        "rawTerms": [" 1937-05-27 to 1940-05-10"],
        "titleName": "Prime Minister Neville Chamberlain",
        "terms": [["1937-05-27", "1940-05-10"]]
    }, {
        "name": "Winston Churchill",
        "href": "http://www.worldpresidentsdb.com/Winston-Churchill/",
        "rawTerms": ["05/10/1940 to 05/23/1945\r\n05/23/1945 to 07/27/1945\r\n10/26/1951 to 04/07/1955"],
        "titleName": "Prime Minister Winston Churchill",
        "terms": [["1940-05-10", "1945-05-23"]]
    }, {
        "name": "Clement Attlee",
        "href": "http://www.worldpresidentsdb.com/Clement-Attlee/",
        "rawTerms": [" 1945-07-27 to 1951-10-26"],
        "titleName": "Prime Minister Clement Attlee",
        "terms": [["1945-07-27", "1951-10-26"]]
    }, {
        "name": "Anthony Eden",
        "href": "http://www.worldpresidentsdb.com/Anthony-Eden/",
        "rawTerms": [" 1955-04-07 to 1957-01-09"],
        "titleName": "Prime Minister Anthony Eden",
        "terms": [["1955-04-07", "1957-01-09"]]
    }, {
        "name": "Harold Macmillan",
        "href": "http://www.worldpresidentsdb.com/Harold-Macmillan/",
        "rawTerms": [" 1957-01-11 to 1963-10-20"],
        "titleName": "Prime Minister Harold Macmillan",
        "terms": [["1957-01-11", "1963-10-20"]]
    }, {
        "name": "Alec Douglas Home",
        "href": "http://www.worldpresidentsdb.com/Alec-Douglas-Home/",
        "rawTerms": [" 1963-10-20 to 1964-10-16"],
        "titleName": "Prime Minister Alec Douglas Home",
        "terms": [["1963-10-20", "1964-10-16"]]
    }, {
        "name": "Harold Wilson",
        "href": "http://www.worldpresidentsdb.com/Harold-Wilson/",
        "rawTerms": ["10/16/1964 tp 06/19/1970\r\n03/04/1974 to 04/05/1976"],
        "titleName": "Prime Minister Harold Wilson",
        "terms": [["1974-03-04", "1976-04-05"]]
    }, {
        "name": "Edward Heath",
        "href": "http://www.worldpresidentsdb.com/Edward-Heath/",
        "rawTerms": [" 1970-06-19 to 1974-03-04"],
        "titleName": "Prime Minister Edward Heath",
        "terms": [["1970-06-19", "1974-03-04"]]
    }, {
        "name": "James Callaghan",
        "href": "http://www.worldpresidentsdb.com/James-Callaghan/",
        "rawTerms": [" 1976-04-05 to 1979-05-04"],
        "titleName": "Prime Minister James Callaghan",
        "terms": [["1976-04-05", "1979-05-04"]]
    }, {
        "name": "Margaret Thatcher",
        "href": "http://www.worldpresidentsdb.com/Margaret-Thatcher/",
        "rawTerms": [" 1979-05-04 to 1990-11-28"],
        "titleName": "Prime Minister Margaret Thatcher",
        "terms": [["1979-05-04", "1990-11-28"]]
    }, {
        "name": "John Major",
        "href": "http://www.worldpresidentsdb.com/John-Major/",
        "rawTerms": [" 1990-11-28 to 1997-05-02"],
        "titleName": "Prime Minister John Major",
        "terms": [["1990-11-28", "1997-05-02"]]
    }, {
        "name": "Tony Blair",
        "href": "http://www.worldpresidentsdb.com/Tony-Blair/",
        "rawTerms": [" 1997-05-02 to 2007-06-27"],
        "titleName": "Prime Minister Tony Blair",
        "terms": [["1997-05-02", "2007-06-27"]]
    }, {
        "name": "Gordon Brown",
        "href": "http://www.worldpresidentsdb.com/Gordon-Brown/",
        "rawTerms": [" 2007-06-27 to 2010-05-11"],
        "titleName": "Prime Minister Gordon Brown",
        "terms": [["2007-06-27", "2010-05-11"]]
    }, {
        "name": "David Cameron",
        "href": "http://www.worldpresidentsdb.com/David-Cameron/",
        "rawTerms": [" In office since 2010-05-11"],
        "titleName": "Prime Minister David Cameron",
        "terms": [["2010-05-11", null]]
    }],
    "Panama": [{
        "name": "Ricardo Martinelli",
        "href": "http://www.worldpresidentsdb.com/Ricardo-Martinelli/",
        "rawTerms": [" 2009-07-01 to 2014-07-01"],
        "titleName": "President Ricardo Martinelli",
        "terms": [["2009-07-01", "2014-07-01"]]
    }, {
        "name": "Mireya Moscoso",
        "href": "http://www.worldpresidentsdb.com/Mireya-Moscoso/",
        "rawTerms": [" 1999-09-01 to 2004-09-01"],
        "titleName": "President Mireya Moscoso",
        "terms": [["1999-09-01", "2004-09-01"]]
    }, {
        "name": "Martin Torrijos",
        "href": "http://www.worldpresidentsdb.com/Martin-Torrijos/",
        "rawTerms": [" 2004-09-01 to 2009-07-01"],
        "titleName": "President Martin Torrijos",
        "terms": [["2004-09-01", "2009-07-01"]]
    }, {
        "name": "Juan Carlos Varela",
        "href": "http://www.worldpresidentsdb.com/Juan-Carlos-Varela/",
        "rawTerms": [" In office since 2014-07-01"],
        "titleName": "President Juan Carlos Varela",
        "terms": [["2014-07-01", null]]
    }],
    "France": [{
        "name": "Napoleon III",
        "href": "http://www.worldpresidentsdb.com/Napoleon-III/",
        "rawTerms": [" 1848-12-20 to 1852-12-02"],
        "titleName": "President Napoleon III",
        "terms": [["1848-12-20", "1852-12-02"]]
    }, {
        "name": "Adolphe Thiers",
        "href": "http://www.worldpresidentsdb.com/Adolphe-Thiers/",
        "rawTerms": [" 1871-02-17 to 1873-05-24"],
        "titleName": "President Adolphe Thiers",
        "terms": [["1871-02-17", "1873-05-24"]]
    }, {
        "name": "Patrice de Mac Mahon",
        "href": "http://www.worldpresidentsdb.com/Patrice-de-Mac-Mahon/",
        "rawTerms": [" 1873-05-24 to 1879-01-30"],
        "titleName": "President Patrice de Mac Mahon",
        "terms": [["1873-05-24", "1879-01-30"]]
    }, {
        "name": "Jules Grevy",
        "href": "http://www.worldpresidentsdb.com/Jules-Grevy/",
        "rawTerms": [" 1879-01-30 to 1887-12-02"],
        "titleName": "President Jules Grevy",
        "terms": [["1879-01-30", "1887-12-02"]]
    }, {
        "name": "Marie Francois Sadi Carnot",
        "href": "http://www.worldpresidentsdb.com/Marie-Francois-Sadi-Carnot/",
        "rawTerms": [" 1887-12-03 to 1894-06-25"],
        "titleName": "President Marie Francois Sadi Carnot",
        "terms": [["1887-12-03", "1894-06-25"]]
    }, {
        "name": "Jean Casimir Perier",
        "href": "http://www.worldpresidentsdb.com/Jean-Casimir-Perier/",
        "rawTerms": [" 1894-06-27 to 1895-01-16"],
        "titleName": "President Jean Casimir Perier",
        "terms": [["1894-06-27", "1895-01-16"]]
    }, {
        "name": "Felix Faure",
        "href": "http://www.worldpresidentsdb.com/Felix-Faure/",
        "rawTerms": [" 1895-01-17 to 1899-02-16"],
        "titleName": "President Felix Faure",
        "terms": [["1895-01-17", "1899-02-16"]]
    }, {
        "name": "Emile Loubet",
        "href": "http://www.worldpresidentsdb.com/Emile-Loubet/",
        "rawTerms": [" 1899-02-18 to 1906-02-18"],
        "titleName": "President Emile Loubet",
        "terms": [["1899-02-18", "1906-02-18"]]
    }, {
        "name": "Armand Fallieres",
        "href": "http://www.worldpresidentsdb.com/Armand-Fallieres/",
        "rawTerms": [" 1906-02-18 to 1913-02-18"],
        "titleName": "President Armand Fallieres",
        "terms": [["1906-02-18", "1913-02-18"]]
    }, {
        "name": "Raymond Poincare",
        "href": "http://www.worldpresidentsdb.com/Raymond-Poincare/",
        "rawTerms": [" 1913-02-18 to 1920-02-18"],
        "titleName": "President Raymond Poincare",
        "terms": [["1913-02-18", "1920-02-18"]]
    }, {
        "name": "Paul Deschanel",
        "href": "http://www.worldpresidentsdb.com/Paul-Deschanel/",
        "rawTerms": [" 1920-02-18 to 1920-09-21"],
        "titleName": "President Paul Deschanel",
        "terms": [["1920-02-18", "1920-09-21"]]
    }, {
        "name": "Alexandre Millerand",
        "href": "http://www.worldpresidentsdb.com/Alexandre-Millerand/",
        "rawTerms": [" 1920-09-23 to 1924-06-11"],
        "titleName": "President Alexandre Millerand",
        "terms": [["1920-09-23", "1924-06-11"]]
    }, {
        "name": "Gaston Doumergue",
        "href": "http://www.worldpresidentsdb.com/Gaston-Doumergue/",
        "rawTerms": [" 1924-06-13 to 1931-06-13"],
        "titleName": "President Gaston Doumergue",
        "terms": [["1924-06-13", "1931-06-13"]]
    }, {
        "name": "Paul Doumer",
        "href": "http://www.worldpresidentsdb.com/Paul-Doumer/",
        "rawTerms": [" 1931-06-13 to 1932-05-07"],
        "titleName": "President Paul Doumer",
        "terms": [["1931-06-13", "1932-05-07"]]
    }, {
        "name": "Albert Francois Lebrun",
        "href": "http://www.worldpresidentsdb.com/Albert-Francois-Lebrun/",
        "rawTerms": [" 1932-05-10 to 1940-07-10"],
        "titleName": "President Albert Francois Lebrun",
        "terms": [["1932-05-10", "1940-07-10"]]
    }, {
        "name": "Vincent Auriol",
        "href": "http://www.worldpresidentsdb.com/Vincent-Auriol/",
        "rawTerms": [" 1947-01-16 to 1954-01-16"],
        "titleName": "President Vincent Auriol",
        "terms": [["1947-01-16", "1954-01-16"]]
    }, {
        "name": "Rene Coty",
        "href": "http://www.worldpresidentsdb.com/Rene-Coty/",
        "rawTerms": [" 1954-01-16 to 1959-01-08"],
        "titleName": "President Rene Coty",
        "terms": [["1954-01-16", "1959-01-08"]]
    }, {
        "name": "Charles de Gaulle",
        "href": "http://www.worldpresidentsdb.com/Charles-de-Gaulle/",
        "rawTerms": [" 1959-01-08 to 1969-04-28"],
        "titleName": "President Charles de Gaulle",
        "terms": [["1959-01-08", "1969-04-28"]]
    }, {
        "name": "Georges Pompidou",
        "href": "http://www.worldpresidentsdb.com/Georges-Pompidou/",
        "rawTerms": [" 1969-06-20 to 1974-04-02"],
        "titleName": "President Georges Pompidou",
        "terms": [["1969-06-20", "1974-04-02"]]
    }, {
        "name": "Valery Giscard d Estaing",
        "href": "http://www.worldpresidentsdb.com/Valery-Giscard-d-Estaing/",
        "rawTerms": ["05/27/1974 to 05/21/1981"],
        "titleName": "President Valery Giscard d Estaing",
        "terms": [["1974-05-27", "1981-05-21"]]
    }, {
        "name": "Francois Mitterrand",
        "href": "http://www.worldpresidentsdb.com/Francois-Mitterrand/",
        "rawTerms": [" 1981-05-21 to 1988-05-08", " 1988-05-08 to 1995-05-17"],
        "titleName": "President Francois Mitterrand",
        "terms": [["1981-05-21", "1988-05-08"], ["1988-05-08", "1995-05-17"]]
    }, {
        "name": "Jacques Chirac",
        "href": "http://www.worldpresidentsdb.com/Jacques-Chirac/",
        "rawTerms": [" 1995-05-17 to 2002-05-17", " 2002-05-17 to 2007-05-16"],
        "titleName": "President Jacques Chirac",
        "terms": [["1995-05-17", "2002-05-17"], ["2002-05-17", "2007-05-16"]]
    }, {
        "name": "Nicolas Sarkozy",
        "href": "http://www.worldpresidentsdb.com/Nicolas-Sarkozy/",
        "rawTerms": [" 2007-05-16 to 2012-05-15"],
        "titleName": "President Nicolas Sarkozy",
        "terms": [["2007-05-16", "2012-05-15"]]
    }, {
        "name": "Francois Hollande",
        "href": "http://www.worldpresidentsdb.com/Francois-Hollande/",
        "rawTerms": [" In office since 2012-05-15"],
        "titleName": "President Francois Hollande",
        "terms": [["2012-05-15", null]]
    }],
    "Saudi-Arabia": [{
        "name": "Khalid of Saudi Arabia",
        "href": "http://www.worldpresidentsdb.com/Khalid-of-Saudi-Arabia/",
        "rawTerms": [" 1975-03-25 to 1982-06-13"],
        "titleName": "King Khalid of Saudi Arabia",
        "terms": [["1975-03-25", "1982-06-13"]]
    }, {
        "name": "Fahd of Saudi Arabia",
        "href": "http://www.worldpresidentsdb.com/Fahd-of-Saudi-Arabia/",
        "rawTerms": [" 1982-06-13 to 2005-08-01"],
        "titleName": "King Fahd of Saudi Arabia",
        "terms": [["1982-06-13", "2005-08-01"]]
    }, {
        "name": "Abdullah of Saudi Arabia",
        "href": "http://www.worldpresidentsdb.com/Abdullah-of-Saudi-Arabia/",
        "rawTerms": [" In office since 2005-08-01"],
        "titleName": "King Abdullah of Saudi Arabia",
        "terms": [["2005-08-01", null]]
    }],
    "Netherlands": [{
        "name": "Jan Peter Balkenende",
        "href": "http://www.worldpresidentsdb.com/Jan-Peter-Balkenende/",
        "rawTerms": [" 2002-07-22 to 2010-10-14"],
        "titleName": "Prime Minister Jan Peter Balkenende",
        "terms": [["2002-07-22", "2010-10-14"]]
    }, {
        "name": "Wim Kok",
        "href": "http://www.worldpresidentsdb.com/Wim-Kok/",
        "rawTerms": [" 1994-08-22 to 2002-07-22"],
        "titleName": "Prime Minister Wim Kok",
        "terms": [["1994-08-22", "2002-07-22"]]
    }, {
        "name": "Mark Rutte",
        "href": "http://www.worldpresidentsdb.com/Mark-Rutte/",
        "rawTerms": [" In office since 2010-10-14"],
        "titleName": "Prime Minister Mark Rutte",
        "terms": [["2010-10-14", null]]
    }],
    "Slovakia": [{
        "name": "Michal Kovac",
        "href": "http://www.worldpresidentsdb.com/Michal-Kovac/",
        "rawTerms": [" 1993-03-02 to 1998-03-02"],
        "titleName": "President Michal Kovac",
        "terms": [["1993-03-02", "1998-03-02"]]
    }, {
        "name": "Rudolf Schuster",
        "href": "http://www.worldpresidentsdb.com/Rudolf-Schuster/",
        "rawTerms": [" 1999-06-15 to 2004-06-15"],
        "titleName": "President Rudolf Schuster",
        "terms": [["1999-06-15", "2004-06-15"]]
    }, {
        "name": "Ivan Gasparovic",
        "href": "http://www.worldpresidentsdb.com/Ivan-Gasparovic/",
        "rawTerms": [" 2004-06-15 to 2014-06-15", " 1998-07-14 to 1998-10-30"],
        "titleName": "President Ivan Gasparovic",
        "terms": [["2004-06-15", "2014-06-15"], ["1998-07-14", "1998-10-30"]]
    }, {
        "name": "Andrej Kiska",
        "href": "http://www.worldpresidentsdb.com/Andrej-Kiska/",
        "rawTerms": [" In office since 2014-06-15"],
        "titleName": "President Andrej Kiska",
        "terms": [["2014-06-15", null]]
    }],
    "Ireland": [{
        "name": "Douglas Hyde",
        "href": "http://www.worldpresidentsdb.com/Douglas-Hyde/",
        "rawTerms": [" 1938-06-25 to 1945-06-24"],
        "titleName": "President Douglas Hyde",
        "terms": [["1938-06-25", "1945-06-24"]]
    }, {
        "name": "Sean O Kelly",
        "href": "http://www.worldpresidentsdb.com/Sean-O-Kelly/",
        "rawTerms": [" 1945-06-25 to 1959-06-24"],
        "titleName": "President Sean O Kelly",
        "terms": [["1945-06-25", "1959-06-24"]]
    }, {
        "name": "Eamon de Valera",
        "href": "http://www.worldpresidentsdb.com/Eamon-de-Valera/",
        "rawTerms": [" 1959-06-25 to 1973-06-24"],
        "titleName": "President Eamon de Valera",
        "terms": [["1959-06-25", "1973-06-24"]]
    }, {
        "name": "Erskine Hamilton Childers",
        "href": "http://www.worldpresidentsdb.com/Erskine-Hamilton-Childers/",
        "rawTerms": [" 1973-06-25 to 1974-11-17"],
        "titleName": "President Erskine Hamilton Childers",
        "terms": [["1973-06-25", "1974-11-17"]]
    }, {
        "name": "Cearbhall O Dalaigh",
        "href": "http://www.worldpresidentsdb.com/Cearbhall-O-Dalaigh/",
        "rawTerms": [" 1974-12-19 to 1976-10-22"],
        "titleName": "President Cearbhall O Dalaigh",
        "terms": [["1974-12-19", "1976-10-22"]]
    }, {
        "name": "Patrick Hillery",
        "href": "http://www.worldpresidentsdb.com/Patrick-Hillery/",
        "rawTerms": [" 1976-12-03 to 1990-12-02"],
        "titleName": "President Patrick Hillery",
        "terms": [["1976-12-03", "1990-12-02"]]
    }, {
        "name": "Mary Robinson",
        "href": "http://www.worldpresidentsdb.com/Mary-Robinson/",
        "rawTerms": ["12/03/1990 to 09/12/1997"],
        "titleName": "President Mary Robinson",
        "terms": [["1990-12-03", "1997-09-12"]]
    }, {
        "name": "Mary McAleese",
        "href": "http://www.worldpresidentsdb.com/Mary-McAleese/",
        "rawTerms": [" 1997-11-11 to 2004-11-11", " 2004-01-11 to 2011-11-10"],
        "titleName": "President Mary McAleese",
        "terms": [["1997-11-11", "2004-11-11"], ["2004-01-11", "2011-11-10"]]
    }, {
        "name": "Michael Higgins",
        "href": "http://www.worldpresidentsdb.com/Michael-Higgins/",
        "rawTerms": [" In office since 2011-11-11"],
        "titleName": "President Michael Higgins",
        "terms": [["2011-11-11", null]]
    }],
    "Palestine": [{
        "name": "Yasser Arafat",
        "href": "http://www.worldpresidentsdb.com/Yasser-Arafat/",
        "rawTerms": [" 1994-07-05 to 2004-11-11"],
        "titleName": "President Yasser Arafat",
        "terms": [["1994-07-05", "2004-11-11"]]
    }, {
        "name": "Mahmoud Abbas",
        "href": "http://www.worldpresidentsdb.com/Mahmoud-Abbas/",
        "rawTerms": [" In office since 2005-01-15"],
        "titleName": "President Mahmoud Abbas",
        "terms": [["2005-01-15", null]]
    }],
    "Argentina": [{
        "name": "Raul Alfonsin",
        "href": "http://www.worldpresidentsdb.com/Raul-Alfonsin/",
        "rawTerms": [" 1983-12-10 to 1989-07-08"],
        "titleName": "President Raul Alfonsin",
        "terms": [["1983-12-10", "1989-07-08"]]
    }, {
        "name": "Reynaldo Bignone",
        "href": "http://www.worldpresidentsdb.com/Reynaldo-Bignone/",
        "rawTerms": [" 1982-07-01 to 1983-12-10"],
        "titleName": "Dictator Reynaldo Bignone",
        "terms": [["1982-07-01", "1983-12-10"]]
    }, {
        "name": "Fernando de la Rua",
        "href": "http://www.worldpresidentsdb.com/Fernando-de-la-Rua/",
        "rawTerms": [" 1999-12-10 to 2001-12-21"],
        "titleName": "President Fernando de la Rua",
        "terms": [["1999-12-10", "2001-12-21"]]
    }, {
        "name": "Eduardo Duhalde",
        "href": "http://www.worldpresidentsdb.com/Eduardo-Duhalde/",
        "rawTerms": [" 2002-01-02 to 2003-05-25"],
        "titleName": "President Eduardo Duhalde",
        "terms": [["2002-01-02", "2003-05-25"]]
    }, {
        "name": "Cristina Fernandez de Kirchner",
        "href": "http://www.worldpresidentsdb.com/Cristina-Fernandez-de-Kirchner/",
        "rawTerms": [" 2007-12-10 to 2011-12-10", " In office since 2011-12-10"],
        "titleName": "President Cristina Fernandez de Kirchner",
        "terms": [["2007-12-10", "2011-12-10"], ["2011-12-10", null]]
    }, {
        "name": "Leopoldo Galtieri",
        "href": "http://www.worldpresidentsdb.com/Leopoldo-Galtieri/",
        "rawTerms": ["De Facto President 12/22/1981 to 06/18/1982"],
        "titleName": "Dictator Leopoldo Galtieri",
        "terms": [["1981-12-22", "1982-06-18"]]
    }, {
        "name": "Nestor Kirchner",
        "href": "http://www.worldpresidentsdb.com/Nestor-Kirchner/",
        "rawTerms": [" 2003-05-25 to 2007-12-10"],
        "titleName": "President Nestor Kirchner",
        "terms": [["2003-05-25", "2007-12-10"]]
    }, {
        "name": "Carlos Menem",
        "href": "http://www.worldpresidentsdb.com/Carlos-Menem/",
        "rawTerms": [" 1989-07-08 to 1995-12-10", " 1995-12-10 to 1999-12-10"],
        "titleName": "President Carlos Menem",
        "terms": [["1989-07-08", "1995-12-10"], ["1995-12-10", "1999-12-10"]]
    }, {
        "name": "Peron",
        "href": "http://www.worldpresidentsdb.com/Peron/",
        "rawTerms": ["06/04/1946 to 06/04/1952\r\n06/04/1952 to 09/21/1955\r\n10/12/1973 to 07/01/1974"],
        "titleName": "President Peron",
        "terms": [["1946-06-04", "1952-06-04"]]
    }, {
        "name": "Isabel Peron",
        "href": "http://www.worldpresidentsdb.com/Isabel-Peron/",
        "rawTerms": ["07/01/1974 to 03/24/1976"],
        "titleName": "President Isabel Peron",
        "terms": [["1974-07-01", "1976-03-24"]]
    }, {
        "name": "Bernardino Rivadavia",
        "href": "http://www.worldpresidentsdb.com/Bernardino-Rivadavia/",
        "rawTerms": ["02/08/1826 to 07/07/1827"],
        "titleName": "President Bernardino Rivadavia",
        "terms": [["1826-02-08", "1827-07-07"]]
    }, {
        "name": "Jorge Rafael Videla",
        "href": "http://www.worldpresidentsdb.com/Jorge-Rafael-Videla/",
        "rawTerms": ["De Facto President 03/24/1976 to 03/29/1981"],
        "titleName": "Dictator Jorge Rafael Videla",
        "terms": [["1976-03-24", "1981-03-29"]]
    }],
    "Bolivia": [{
        "name": "Carlos Mesa",
        "href": "http://www.worldpresidentsdb.com/Carlos-Mesa/",
        "rawTerms": [" 2003-10-17 to 2005-06-06"],
        "titleName": "President Carlos Mesa",
        "terms": [["2003-10-17", "2005-06-06"]]
    }, {
        "name": "Evo Morales",
        "href": "http://www.worldpresidentsdb.com/Evo-Morales/",
        "rawTerms": [" In office since 2006-01-22"],
        "titleName": "President Evo Morales",
        "terms": [["2006-01-22", null]]
    }, {
        "name": "Eduardo Rodriguez",
        "href": "http://www.worldpresidentsdb.com/Eduardo-Rodriguez/",
        "rawTerms": [" 2005-06-09 to 2006-01-22"],
        "titleName": "President Eduardo Rodriguez",
        "terms": [["2005-06-09", "2006-01-22"]]
    }],
    "Norway": [{
        "name": "Thorbjorn Jagland",
        "href": "http://www.worldpresidentsdb.com/Thorbjorn-Jagland/",
        "rawTerms": [" 1996-10-25 to 1997-10-17"],
        "titleName": "Prime Minister Thorbjorn Jagland",
        "terms": [["1996-10-25", "1997-10-17"]]
    }, {
        "name": "Kjell Magne Bondevik",
        "href": "http://www.worldpresidentsdb.com/Kjell-Magne-Bondevik/",
        "rawTerms": [" 2001-10-19 to 2005-10-17"],
        "titleName": "Prime Minister Kjell Magne Bondevik",
        "terms": [["2001-10-19", "2005-10-17"]]
    }, {
        "name": "Jens Stoltenberg",
        "href": "http://www.worldpresidentsdb.com/Jens-Stoltenberg/",
        "rawTerms": [" 2005-10-17 to 2013-10-16", " 2000-03-03 to 2001-10-19"],
        "titleName": "Prime Minister Jens Stoltenberg",
        "terms": [["2005-10-17", "2013-10-16"], ["2000-03-03", "2001-10-19"]]
    }, {
        "name": "Erna Solberg",
        "href": "http://www.worldpresidentsdb.com/Erna-Solberg/",
        "rawTerms": [" In office since 2013-10-16"],
        "titleName": "Prime Minister Erna Solberg",
        "terms": [["2013-10-16", null]]
    }],
    "Thailand": [{
        "name": "Thaksin Shinawatra",
        "href": "http://www.worldpresidentsdb.com/Thaksin-Shinawatra/",
        "rawTerms": [" 2006-05-23 to 2006-09-19", " 2001-02-09 to 2006-04-05"],
        "titleName": "Prime Minister Thaksin Shinawatra",
        "terms": [["2006-05-23", "2006-09-19"], ["2001-02-09", "2006-04-05"]]
    }, {
        "name": "Abhisit Vejjajiva",
        "href": "http://www.worldpresidentsdb.com/Abhisit-Vejjajiva/",
        "rawTerms": [" 2008-12-17 to 2011-08-05"],
        "titleName": "Prime Minister Abhisit Vejjajiva",
        "terms": [["2008-12-17", "2011-08-05"]]
    }, {
        "name": "Yingluck Shinawatra",
        "href": "http://www.worldpresidentsdb.com/Yingluck-Shinawatra/",
        "rawTerms": [" 2011-08-05 to 2014-05-07"],
        "titleName": "Prime Minister Yingluck Shinawatra",
        "terms": [["2011-08-05", "2014-05-07"]]
    }, {
        "name": "Prayut Chan o cha",
        "href": "http://www.worldpresidentsdb.com/Prayut-Chan-o-cha/",
        "rawTerms": [" In office since 2014-08-24"],
        "titleName": "Prime Minister Prayut Chan o cha",
        "terms": [["2014-08-24", null]]
    }],
    "Ecuador": [{
        "name": "Rafael Correa",
        "href": "http://www.worldpresidentsdb.com/Rafael-Correa/",
        "rawTerms": [" In office since 2007-01-15"],
        "titleName": "President Rafael Correa",
        "terms": [["2007-01-15", null]]
    }, {
        "name": "Leon Febres Cordero",
        "href": "http://www.worldpresidentsdb.com/Leon-Febres-Cordero/",
        "rawTerms": [" 1984-08-10 to 1988-08-10"],
        "titleName": "President Leon Febres Cordero",
        "terms": [["1984-08-10", "1988-08-10"]]
    }, {
        "name": "Alfredo Palacio",
        "href": "http://www.worldpresidentsdb.com/Alfredo-Palacio/",
        "rawTerms": [" 2005-04-20 to 2007-01-15"],
        "titleName": "President Alfredo Palacio",
        "terms": [["2005-04-20", "2007-01-15"]]
    }],
    "North-Korea": [{
        "name": "Kim Il sung",
        "href": "http://www.worldpresidentsdb.com/Kim-Il-sung/",
        "rawTerms": [" 1949-06-30 to 1994-07-08"],
        "titleName": "Dictator Kim Il sung",
        "terms": [["1949-06-30", "1994-07-08"]]
    }, {
        "name": "Kim Jong un",
        "href": "http://www.worldpresidentsdb.com/Kim-Jong-un/",
        "rawTerms": [" In office since 2012-04-11"],
        "titleName": "Dictator Kim Jong un",
        "terms": [["2012-04-11", null]]
    }, {
        "name": "Kim Jong il",
        "href": "http://www.worldpresidentsdb.com/Kim-Jong-il/",
        "rawTerms": [" 1993-04-09 to 2011-12-17"],
        "titleName": "Dictator Kim Jong il",
        "terms": [["1993-04-09", "2011-12-17"]]
    }],
    "Ghana": [{
        "name": "John Kufuor",
        "href": "http://www.worldpresidentsdb.com/John-Kufuor/",
        "rawTerms": [" 2001-01-07 to 2009-01-07"],
        "titleName": "President John Kufuor",
        "terms": [["2001-01-07", "2009-01-07"]]
    }, {
        "name": "John Dramani Mahama",
        "href": "http://www.worldpresidentsdb.com/John-Dramani-Mahama/",
        "rawTerms": [" In office since 2012-07-24"],
        "titleName": "President John Dramani Mahama",
        "terms": [["2012-07-24", null]]
    }, {
        "name": "John Atta Mills",
        "href": "http://www.worldpresidentsdb.com/John-Atta-Mills/",
        "rawTerms": [" 2009-01-07 to 2012-07-24"],
        "titleName": "President John Atta Mills",
        "terms": [["2009-01-07", "2012-07-24"]]
    }],
    "Israel": [{
        "name": "Moshe Katsav",
        "href": "http://www.worldpresidentsdb.com/Moshe-Katsav/",
        "rawTerms": [" 2000-08-01 to 2007-07-15"],
        "titleName": "President Moshe Katsav",
        "terms": [["2000-08-01", "2007-07-15"]]
    }, {
        "name": "Benjamin Netanyahu",
        "href": "http://www.worldpresidentsdb.com/Benjamin-Netanyahu/",
        "rawTerms": [" 2009-03-31 to 2013-03-18", " In office since 2013-03-18"],
        "titleName": "Prime Minister Benjamin Netanyahu",
        "terms": [["2009-03-31", "2013-03-18"], ["2013-03-18", null]]
    }, {
        "name": "Ehud Olmert",
        "href": "https://es.wikipedia.org/wiki/Ehud_Olmert",
        "rawTerms": ["4 de enero de 2006-31 de marzo de 2009"],
        "titleName": "Prime Minister Ehud Olmert",
        "terms": [["2006-01-04","2009-03-31"]]
    }],
    "Australia": [{
        "name": "Edmund Barton",
        "href": "http://www.worldpresidentsdb.com/Edmund-Barton/",
        "rawTerms": [" 1901-01-01 to 1903-09-24"],
        "titleName": "Prime Minister Edmund Barton",
        "terms": [["1901-01-01", "1903-09-24"]]
    }, {
        "name": "Alfred Deakin",
        "href": "http://www.worldpresidentsdb.com/Alfred-Deakin/",
        "rawTerms": [" 1903-09-24 to 1904-04-27", " 1905-07-05 to 1908-11-13", " 1909-06-02 to 1910-04-29"],
        "titleName": "Prime Minister Alfred Deakin",
        "terms": [["1903-09-24", "1904-04-27"], ["1905-07-05", "1908-11-13"], ["1909-06-02", "1910-04-29"]]
    }, {
        "name": "Chris Watson",
        "href": "http://www.worldpresidentsdb.com/Chris-Watson/",
        "rawTerms": [" 1904-04-27 to 1904-08-18"],
        "titleName": "Prime Minister Chris Watson",
        "terms": [["1904-04-27", "1904-08-18"]]
    }, {
        "name": "George Reid",
        "href": "http://www.worldpresidentsdb.com/George-Reid/",
        "rawTerms": [" 1904-08-18 to 1905-07-05"],
        "titleName": "Prime Minister George Reid",
        "terms": [["1904-08-18", "1905-07-05"]]
    }, {
        "name": "Andrew Fisher",
        "href": "http://www.worldpresidentsdb.com/Andrew-Fisher/",
        "rawTerms": ["13 November 1908 \u0096 2 June 1909\r\n29 April 1910 \u0096 24 June 1913\r\n17 September 1914 \u0096 27 October 1915"],
        "titleName": "Prime Minister Andrew Fisher",
        "terms": [["1908-11-13", "1909-06-02"], ["1910-04-29", "1913-06-24"], ["1914-09-17", "1915-10-27"]]
    }, {
        "name": "Joseph Cook",
        "href": "http://www.worldpresidentsdb.com/Joseph-Cook/",
        "rawTerms": ["24 June 1913 \u0096 17 September 1914"],
        "titleName": "Prime Minister Joseph Cook",
        "terms": [["1913-06-24", "1914-09-17"]]
    }, {
        "name": "Billy Hughes",
        "href": "http://www.worldpresidentsdb.com/Billy-Hughes/",
        "rawTerms": ["27 October 1915 \u0096 9 February 1923"],
        "titleName": "Prime Minister Billy Hughes",
        "terms": [["1915-10-27", "1923-02-09"]]
    }, {
        "name": "Stanley Bruce",
        "href": "http://www.worldpresidentsdb.com/Stanley-Bruce/",
        "rawTerms": ["9 February 1923 \u0096 22 October 1929"],
        "titleName": "Prime Minister Stanley Bruce",
        "terms": [["1923-02-09", "1929-10-22"]]
    }, {
        "name": "James Scullin",
        "href": "http://www.worldpresidentsdb.com/James-Scullin/",
        "rawTerms": ["22 October 1929 \u0096 6 January 1932"],
        "titleName": "Prime Minister James Scullin",
        "terms": [["1929-10-22", "1932-01-06"]]
    }, {
        "name": "Joseph Lyons",
        "href": "http://www.worldpresidentsdb.com/Joseph-Lyons/",
        "rawTerms": ["6 January 1932 \u0096 7 April 1939"],
        "titleName": "Prime Minister Joseph Lyons",
        "terms": [["1932-01-06", "1939-04-07"]]
    }, {
        "name": "Earle Page",
        "href": "http://www.worldpresidentsdb.com/Earle-Page/",
        "rawTerms": ["7 April \u0096 26 April 1939"],
        "titleName": "Prime Minister Earle Page",
        "terms": [["1039-04-07", "1939-04-26"]]
    }, {
        "name": "Robert Menzies",
        "href": "http://www.worldpresidentsdb.com/Robert-Menzies/",
        "rawTerms": ["26 April 1939 \u0096 26 August 1941\r\n19 December 1949 \u0096 26 January 1966"],
        "titleName": "Prime Minister Robert Menzies",
        "terms": [["1939-04-26", "1941-08-26"], ["1949-12-19", "1966-01-26"]]
    }, {
        "name": "Arthur Fadden",
        "href": "http://www.worldpresidentsdb.com/Arthur-Fadden/",
        "rawTerms": ["29 August 1941 \u0096 7 October 1941"],
        "titleName": "Prime Minister Arthur Fadden",
        "terms": [["1941-08-29", "1931-10-07"]]
    }, {
        "name": "John Curtin",
        "href": "http://www.worldpresidentsdb.com/John-Curtin/",
        "rawTerms": ["7 October 1941 \u0096 5 July 1945"],
        "titleName": "Prime Minister John Curtin",
        "terms": [["1941-10-07", "1945-07-05"]]
    }, {
        "name": "Frank Forde",
        "href": "http://www.worldpresidentsdb.com/Frank-Forde/",
        "rawTerms": ["6 July 1945 \u0096 13 July 1945"],
        "titleName": "Prime Minister Frank Forde",
        "terms": [["1945-07-06", "1945-07-12"]]
    }, {
        "name": "Ben Chifley",
        "href": "http://www.worldpresidentsdb.com/Ben-Chifley/",
        "rawTerms": ["13 July 1945 \u0096 19 December 1949"],
        "titleName": "Prime Minister Ben Chifley",
        "terms": [["1945-07-13", "1949-12-19"]]
    }, {
        "name": "Harold Holt",
        "href": "http://www.worldpresidentsdb.com/Harold-Holt/",
        "rawTerms": ["26 January 1966 \u0096 17 December 1967"],
        "titleName": "Prime Minister Harold Holt",
        "terms": [["1966-01-26", "1967-12-17"]]
    }, {
        "name": "John McEwen",
        "href": "http://www.worldpresidentsdb.com/John-McEwen/",
        "rawTerms": ["19 December 1967 \u0096 10 January 1968"],
        "titleName": "Prime Minister John McEwen",
        "terms": [["1967-12-19", "1968-01-10"]]
    }, {
        "name": "John Gorton",
        "href": "http://www.worldpresidentsdb.com/John-Gorton/",
        "rawTerms": ["10 January 1968 \u0096 10 March 1971"],
        "titleName": "Prime Minister John Gorton",
        "terms": [["1968-01-10", "1971-03-10"]]
    }, {
        "name": "William McMahon",
        "href": "http://www.worldpresidentsdb.com/William-McMahon/",
        "rawTerms": ["10 March 1971 \u0096 5 December 1972"],
        "titleName": "Prime Minister William McMahon",
        "terms": [["1971-03-10", "1972-12-05"]]
    }, {
        "name": "Gough Whitlam",
        "href": "http://www.worldpresidentsdb.com/Gough-Whitlam/",
        "rawTerms": ["5 December 1972 \u0096 11 November 1975"],
        "titleName": "Prime Minister Gough Whitlam",
        "terms": [["1972-12-05", "1975-11-11"]]
    }, {
        "name": "Malcolm Fraser",
        "href": "http://www.worldpresidentsdb.com/Malcolm-Fraser/",
        "rawTerms": ["11 November 1975 \u0096 11 March 1983"],
        "titleName": "Prime Minister Malcolm Fraser",
        "terms": [["1975-11-11", "1983-03-11"]]
    }, {
        "name": "Robert Hawke",
        "href": "http://www.worldpresidentsdb.com/Robert-Hawke/",
        "rawTerms": ["03/11/1983 to 12/20/1991"],
        "titleName": "Prime Minister Robert Hawke",
        "terms": [["1983-03-11", "1991-12-20"]]
    }, {
        "name": "Paul Keating",
        "href": "http://www.worldpresidentsdb.com/Paul-Keating/",
        "rawTerms": ["12/20/1991 to 03/11/1996"],
        "titleName": "Prime Minister Paul Keating",
        "terms": [["1991-12-20", "1996-03-11"]]
    }, {
        "name": "John Howard",
        "href": "http://www.worldpresidentsdb.com/John-Howard/",
        "rawTerms": [" 1996-03-11 to 2007-12-03"],
        "titleName": "Prime Minister John Howard",
        "terms": [["1996-03-11", "2007-12-03"]]
    }, {
        "name": "Kevin Rudd",
        "href": "http://www.worldpresidentsdb.com/Kevin-Rudd/",
        "rawTerms": [" 2007-12-03 to 2010-06-24"],
        "titleName": "Prime Minister Kevin Rudd",
        "terms": [["2007-12-03", "2010-06-24"]]
    }, {
        "name": "Julia Gillard",
        "href": "http://www.worldpresidentsdb.com/Julia-Gillard/",
        "rawTerms": [" 2010-06-24 to 2013-06-27"],
        "titleName": "Prime Minister Julia Gillard",
        "terms": [["2010-06-24", "2013-06-27"]]
    }, {
        "name": "Tony Abbott",
        "href": "http://www.worldpresidentsdb.com/Tony-Abbott/",
        "rawTerms": [" In office since 2013-09-18"],
        "titleName": "Prime Minister Tony Abbott",
        "terms": [["2013-09-18", null]]
    }],
    "Iran": [{
        "name": "Akbar Hashemi Rafsanjani",
        "href": "http://www.worldpresidentsdb.com/Akbar-Hashemi-Rafsanjani/",
        "rawTerms": [" 1989-08-03 to 1993-08-03", " 1993-08-03 to 1997-08-03"],
        "titleName": "President Akbar Hashemi Rafsanjani",
        "terms": [["1989-08-03", "1993-08-03"], ["1993-08-03", "1997-08-03"]]
    }, {
        "name": "Mohammad Khatami",
        "href": "http://www.worldpresidentsdb.com/Mohammad-Khatami/",
        "rawTerms": [" 1997-08-03 to 2001-08-03", " 2001-08-03 to 2005-08-03"],
        "titleName": "President Mohammad Khatami",
        "terms": [["1997-08-03", "2001-08-03"], ["2001-08-03", "2005-08-03"]]
    }, {
        "name": "Mahmoud Ahmadinejad",
        "href": "http://www.worldpresidentsdb.com/Mahmoud-Ahmadinejad/",
        "rawTerms": [" 2005-08-03 to 2013-08-03"],
        "titleName": "President Mahmoud Ahmadinejad",
        "terms": [["2005-08-03", "2013-08-03"]]
    }, {
        "name": "Hassan Rouhani",
        "href": "http://www.worldpresidentsdb.com/Hassan-Rouhani/",
        "rawTerms": [" In office since 2013-08-04"],
        "titleName": "President Hassan Rouhani",
        "terms": [["2013-08-04", null]]
    }],
    "Cuba": [{
        "name": "Fidel Castro",
        "href": "http://www.worldpresidentsdb.com/Fidel-Castro/",
        "rawTerms": ["February 16, 1959 \u0096 February 24, 2008["],
        "titleName": "President Fidel Castro",
        "terms": [["1959-02-16", "2008-02-24"]]
    }, {
        "name": "Raul Castro",
        "href": "http://www.worldpresidentsdb.com/Raul-Castro/",
        "rawTerms": ["Assumed office 24 February 2008\r\nActing: 31 July 2006 \u0096 24 February 2008"],
        "titleName": "Dictator Raul Castro",
        "terms": [["2008-02-24", null]]
    }],
    "Turkey": [{
        "name": "Ismet Inonu",
        "href": "http://www.worldpresidentsdb.com/Ismet-Inonu/",
        "rawTerms": [" 1938-11-11 to 1950-05-22"],
        "titleName": "President Ismet Inonu",
        "terms": [["1938-11-11", "1950-05-22"]]
    }, {
        "name": "Ahmet Necdet Sezer",
        "href": "http://www.worldpresidentsdb.com/Ahmet-Necdet-Sezer/",
        "rawTerms": [" 2000-05-16 to 2007-08-28"],
        "titleName": "President Ahmet Necdet Sezer",
        "terms": [["2000-05-16", "2007-08-28"]]
    }, {
        "name": "Abdullah Gul",
        "href": "http://www.worldpresidentsdb.com/Abdullah-Gul/",
        "rawTerms": [" 2007-08-28 to 2014-08-28"],
        "titleName": "President Abdullah Gul",
        "terms": [["2007-08-28", "2014-08-28"]]
    }, {
        "name": "Recep Tayyip Erdogan",
        "href": "http://www.worldpresidentsdb.com/Recep-Tayyip-Erdogan/",
        "rawTerms": [" In office since 2014-08-28"],
        "titleName": "President Recep Tayyip Erdogan",
        "terms": [["2014-08-28", null]]
    }],
    "Venezuela": [{
        "name": "Rafael Caldera",
        "href": "http://www.worldpresidentsdb.com/Rafael-Caldera/",
        "rawTerms": [" 1969-03-11 to 1974-03-11", " 1994-02-02 to 1999-02-02"],
        "titleName": "President Rafael Caldera",
        "terms": [["1969-03-11", "1974-03-11"], ["1994-02-02", "1999-02-02"]]
    }, {
        "name": "Hugo Chavez",
        "href": "http://www.worldpresidentsdb.com/Hugo-Chavez/",
        "rawTerms": [" 1999-02-02 to 2001-01-10", " 2001-01-10 to 2007-01-10", " 2007-01-10 to 2013-01-10", " 2013-01-10 to 2013-03-05"],
        "titleName": "President Hugo Chavez",
        "terms": [["1999-02-02", "2001-01-10"], ["2001-01-10", "2007-01-10"], ["2007-01-10", "2013-01-10"], ["2013-01-10", "2013-03-05"]]
    }, {
        "name": "Octavio Lepage",
        "href": "http://www.worldpresidentsdb.com/Octavio-Lepage/",
        "rawTerms": [" 1993-05-21 to 1993-06-05"],
        "titleName": "President Octavio Lepage",
        "terms": [["1993-05-21", "1993-06-05"]]
    }, {
        "name": "Nicolas Maduro",
        "href": "http://www.worldpresidentsdb.com/Nicolas-Maduro/",
        "rawTerms": [" In office since 2013-04-19"],
        "titleName": "President Nicolas Maduro",
        "terms": [["2013-04-19", null]]
    }, {
        "name": "Ramon Jose Velasquez",
        "href": "http://www.worldpresidentsdb.com/Ramon-Jose-Velasquez/",
        "rawTerms": ["06/05/1993 to 02/02/1994"],
        "titleName": "President Ramon Jose Velasquez",
        "terms": [["1993-06-05", "1994-02-02"]]
    }],
    "Japan": [{
        "name": "Yoshiro Mori",
        "href": "http://www.worldpresidentsdb.com/Yoshiro-Mori/",
        "rawTerms": [" 2000-04-05 to 2000-07-04", " 2000-07-04 to 2001-04-26"],
        "titleName": "Prime Minister Yoshiro Mori",
        "terms": [["2000-04-05", "2000-07-04"], ["2000-07-04", "2001-04-26"]]
    }, {
        "name": "Junichiro Koizumi",
        "href": "http://www.worldpresidentsdb.com/Junichiro-Koizumi/",
        "rawTerms": [" 2001-04-26 to 2003-11-19", " 2003-11-19 to 2005-09-21", " 2005-09-21 to 2006-09-26"],
        "titleName": "Prime Minister Junichiro Koizumi",
        "terms": [["2001-04-26", "2003-11-19"], ["2003-11-19", "2005-09-21"], ["2005-09-21", "2006-09-26"]]
    }, {
        "name": "Shinzo Abe",
        "href": "http://www.worldpresidentsdb.com/Shinzo-Abe/",
        "rawTerms": [" 2006-09-26 to 2007-09-26", " In office since 2012-12-26"],
        "titleName": "Prime Minister Shinzo Abe",
        "terms": [["2006-09-26", "2007-09-26"], ["2012-12-26", null]]
    }, {
        "name": "Yasuo Fukuda",
        "href": "http://www.worldpresidentsdb.com/Yasuo-Fukuda/",
        "rawTerms": ["26 September 2007 \u0096 24 September 2008"],
        "titleName": "Prime Minister Yasuo Fukuda",
        "terms": [["2007-09-26", "2008-09-24"]]
    }],
    "Guatemala": [{
        "name": "Oscar Berger",
        "href": "http://www.worldpresidentsdb.com/Oscar-Berger/",
        "rawTerms": [" 2004-01-14 to 2008-01-14"],
        "titleName": "President Oscar Berger",
        "terms": [["2004-01-14", "2008-01-14"]]
    }, {
        "name": "Otto Perez Molina",
        "href": "http://www.worldpresidentsdb.com/Otto-Perez-Molina/",
        "rawTerms": [" In office since 2012-01-14"],
        "titleName": "President Otto Perez Molina",
        "terms": [["2012-01-14", null]]
    }, {
        "name": "Alfonso Portillo",
        "href": "http://www.worldpresidentsdb.com/Alfonso-Portillo/",
        "rawTerms": ["01/14/2000 to 01/14/2004"],
        "titleName": "President Alfonso Portillo",
        "terms": [["2000-01-14", "2004-01-14"]]
    }],
    "China": [{
        "name": "Hu Jintao",
        "href": "http://www.worldpresidentsdb.com/Hu-Jintao/",
        "rawTerms": [" 2002-11-15 to 2012-11-15"],
        "titleName": "President Hu Jintao",
        "terms": [["2002-11-15", "2012-11-15"]]
    }, {
        "name": "Yang Shangkun",
        "href": "http://www.worldpresidentsdb.com/Yang-Shangkun/",
        "rawTerms": ["04/08/1988 to 03/27/1993"],
        "titleName": "President Yang Shangkun",
        "terms": [["1988-04-08", "1993-03-27"]]
    }, {
        "name": "Xi Jinping",
        "href": "http://www.worldpresidentsdb.com/Xi-Jinping/",
        "rawTerms": [" In office since 2013-03-14"],
        "titleName": "President Xi Jinping",
        "terms": [["2013-03-14", null]]
    }, {
        "name": "Jiang Zemin",
        "href": "http://www.worldpresidentsdb.com/Jiang-Zemin/",
        "rawTerms": ["03/27/1993 to 03/15/2003"],
        "titleName": "President Jiang Zemin",
        "terms": [["1993-03-27", "2003-03-15"]]
    }],
    "Chile": [{
        "name": "Patricio Aylwin",
        "href": "http://www.worldpresidentsdb.com/Patricio-Aylwin/",
        "rawTerms": [" 1990-03-11 to 1994-03-11"],
        "titleName": "President Patricio Aylwin",
        "terms": [["1990-03-11", "1994-03-11"]]
    }, {
        "name": "Michelle Bachelet",
        "href": "http://www.worldpresidentsdb.com/Michelle-Bachelet/",
        "rawTerms": [" 2006-03-11 to 2010-03-11", " In office since 2014-03-11"],
        "titleName": "President Michelle Bachelet",
        "terms": [["2006-03-11", "2010-03-11"], ["2014-03-11", null]]
    }, {
        "name": "Eduardo Frei Ruiz Tagle",
        "href": "http://www.worldpresidentsdb.com/Eduardo-Frei-Ruiz-Tagle/",
        "rawTerms": [" 1994-03-11 to 2000-03-11"],
        "titleName": "President Eduardo Frei Ruiz Tagle",
        "terms": [["1994-03-11", "2000-03-11"]]
    }, {
        "name": "Ricardo Lagos",
        "href": "http://www.worldpresidentsdb.com/Ricardo-Lagos/",
        "rawTerms": [" 2000-03-11 to 2006-03-11"],
        "titleName": "President Ricardo Lagos",
        "terms": [["2000-03-11", "2006-03-11"]]
    }, {
        "name": "Sebastian Pinera",
        "href": "http://www.worldpresidentsdb.com/Sebastian-Pinera/",
        "rawTerms": [" 2010-03-11 to 2014-03-11"],
        "titleName": "President Sebastian Pinera",
        "terms": [["2010-03-11", "2014-03-11"]]
    }, {
        "name": "Pinochet",
        "href": "http://www.worldpresidentsdb.com/Pinochet/",
        "rawTerms": ["06/27/1974 to 03/11/1990"],
        "titleName": "President Pinochet",
        "terms": [["1974-06-27", "1990-03-11"]]
    }],
    "Belgium": [{
        "name": "Herman Van Rompuy",
        "href": "http://www.worldpresidentsdb.com/Herman-Van-Rompuy/",
        "rawTerms": [" 2008-12-30 to 2009-11-25"],
        "titleName": "Prime Minister Herman Van Rompuy",
        "terms": [["2008-12-30", "2009-11-25"]]
    }, {
        "name": "Yves Leterme",
        "href": "http://www.worldpresidentsdb.com/Yves-Leterme/",
        "rawTerms": [" 2009-11-25 to 2011-12-06", " 2008-03-20 to 2008-12-30"],
        "titleName": "Prime Minister Yves Leterme",
        "terms": [["2009-11-25", "2011-12-06"], ["2008-03-20", "2008-12-30"]]
    }, {
        "name": "Elio Di Rupo",
        "href": "http://www.worldpresidentsdb.com/Elio-Di-Rupo/",
        "rawTerms": [" 2011-12-06 to 2014-10-11"],
        "titleName": "Prime Minister Elio Di Rupo",
        "terms": [["2011-12-06", "2014-10-11"]]
    }, {
        "name": "Charles Michel",
        "href": "http://www.worldpresidentsdb.com/Charles-Michel/",
        "rawTerms": [" In office since 2014-11-11"],
        "titleName": "Prime Minister Charles Michel",
        "terms": [["2014-11-11", null]]
    }],
    "Germany": [{
        "name": "Karl Carstens",
        "href": "http://www.worldpresidentsdb.com/Karl-Carstens/",
        "rawTerms": [" 1979-07-01 to 1984-06-30"],
        "titleName": "President Karl Carstens",
        "terms": [["1979-07-01", "1984-06-30"]]
    }, {
        "name": "Joachim Gauck",
        "href": "http://www.worldpresidentsdb.com/Joachim-Gauck/",
        "rawTerms": [" In office since 2012-03-18"],
        "titleName": "President Joachim Gauck",
        "terms": [["2012-03-18", null]]
    }, {
        "name": "Roman Herzog",
        "href": "http://www.worldpresidentsdb.com/Roman-Herzog/",
        "rawTerms": [" 1994-07-01 to 1999-07-01"],
        "titleName": "President Roman Herzog",
        "terms": [["1994-07-01", "1999-07-01"]]
    }, {
        "name": "Theodor Heuss",
        "href": "http://www.worldpresidentsdb.com/Theodor-Heuss/",
        "rawTerms": [" 1949-09-13 to 1954-09-13", " 1954-09-13 to 1959-09-13"],
        "titleName": "President Theodor Heuss",
        "terms": [["1949-09-13", "1954-09-13"], ["1954-09-13", "1959-09-13"]]
    }, {
        "name": "Horst Kohler",
        "href": "http://www.worldpresidentsdb.com/Horst-Kohler/",
        "rawTerms": [" 2004-07-01 to 2010-05-31"],
        "titleName": "President Horst Kohler",
        "terms": [["2004-07-01", "2010-05-31"]]
    }, {
        "name": "Johannes Rau",
        "href": "http://www.worldpresidentsdb.com/Johannes-Rau/",
        "rawTerms": ["07/01/1999 to 07/01/2004"],
        "titleName": "President Johannes Rau",
        "terms": [["1999-07-01", "2004-07-01"]]
    }, {
        "name": "Richard von Weizsacker",
        "href": "http://www.worldpresidentsdb.com/Richard-von-Weizsacker/",
        "rawTerms": ["07/01/1984 to 06/30/1994"],
        "titleName": "President Richard von Weizsacker",
        "terms": [["1984-07-01", "1994-06-30"]]
    }, {
        "name": "Christian Wulff",
        "href": "http://www.worldpresidentsdb.com/Christian-Wulff/",
        "rawTerms": [" 2010-07-02 to 2012-02-17"],
        "titleName": "President Christian Wulff",
        "terms": [["2010-07-02", "2012-02-17"]]
    }],
    "Iraq": [{
        "name": "Muhammad Najib Ar Ruba i",
        "href": "http://www.worldpresidentsdb.com/Muhammad-Najib-Ar-Ruba-i/",
        "rawTerms": [" 1958-07-14 to 1963-02-08"],
        "titleName": "President Muhammad Najib Ar Ruba i",
        "terms": [["1958-07-14", "1963-02-08"]]
    }, {
        "name": "Abdul Salam Arif",
        "href": "http://www.worldpresidentsdb.com/Abdul-Salam-Arif/",
        "rawTerms": [" 1963-02-08 to 1966-04-13"],
        "titleName": "President Abdul Salam Arif",
        "terms": [["1963-02-08", "1966-04-13"]]
    }, {
        "name": "Abdul Rahman Arif",
        "href": "http://www.worldpresidentsdb.com/Abdul-Rahman-Arif/",
        "rawTerms": [" 1966-04-16 to 1968-07-17"],
        "titleName": "President Abdul Rahman Arif",
        "terms": [["1966-04-16", "1968-07-17"]]
    }, {
        "name": "Ahmed Hassan al Bakr",
        "href": "http://www.worldpresidentsdb.com/Ahmed-Hassan-al-Bakr/",
        "rawTerms": [" 1968-07-17 to 1979-07-16"],
        "titleName": "President Ahmed Hassan al Bakr",
        "terms": [["1968-07-17", "1979-07-16"]]
    }, {
        "name": "Saddam Hussein",
        "href": "http://www.worldpresidentsdb.com/Saddam-Hussein/",
        "rawTerms": [" 1979-07-16 to 2003-04-09"],
        "titleName": "President Saddam Hussein",
        "terms": [["1979-07-16", "2003-04-09"]]
    }, {
        "name": "Jalal Talabani",
        "href": "http://www.worldpresidentsdb.com/Jalal-Talabani/",
        "rawTerms": [" 2005-04-07 to 2014-07-24"],
        "titleName": "Dictator Jalal Talabani",
        "terms": [["2005-04-07", "2014-07-24"]]
    }, {
        "name": "Fuad Masum",
        "href": "http://www.worldpresidentsdb.com/Fuad-Masum/",
        "rawTerms": [" In office since 2014-07-24"],
        "titleName": "President Fuad Masum",
        "terms": [["2014-07-24", null]]
    }],
    "Poland": [{
        "name": "Lech Kaczynski",
        "href": "http://www.worldpresidentsdb.com/Lech-Kaczynski/",
        "rawTerms": [" 2005-12-23 to 2010-04-10"],
        "titleName": "President Lech Kaczynski",
        "terms": [["2005-12-23", "2010-04-10"]]
    }, {
        "name": "Bronislaw Komorowski",
        "href": "http://www.worldpresidentsdb.com/Bronislaw-Komorowski/",
        "rawTerms": [" In office since 2010-08-06", " 2010-04-10 to 2010-07-08"],
        "titleName": "President Bronislaw Komorowski",
        "terms": [["2010-08-06", null], ["2010-04-10", "2010-07-08"]]
    }, {
        "name": "Aleksander Kwasniewski",
        "href": "http://www.worldpresidentsdb.com/Aleksander-Kwasniewski/",
        "rawTerms": [" 1995-12-23 to 2000-12-23", " 2000-12-23 to 2005-12-23"],
        "titleName": "President Aleksander Kwasniewski",
        "terms": [["1995-12-23", "2000-12-23"], ["2000-12-23", "2005-12-23"]]
    }, {
        "name": "Lech Walesa",
        "href": "http://www.worldpresidentsdb.com/Lech-Walesa/",
        "rawTerms": ["12/23/1990 to 12/23/1995"],
        "titleName": "President Lech Walesa",
        "terms": [["1990-12-23", "1995-12-23"]]
    }],
    "Spain": [{
        "name": "Jose Maria Aznar",
        "href": "http://www.worldpresidentsdb.com/Jose-Maria-Aznar/",
        "rawTerms": [" 1996-05-04 to 2000-05-04", " 2000-05-04 to 2004-04-17"],
        "titleName": "Prime Minister Jose Maria Aznar",
        "terms": [["1996-05-04", "2000-05-04"], ["2000-05-04", "2004-04-17"]]
    }, {
        "name": "Francisco Franco",
        "href": "http://www.worldpresidentsdb.com/Francisco-Franco/",
        "rawTerms": ["02/05/1939 to 11/20/1975"],
        "titleName": "Dictator Francisco Franco",
        "terms": [["1939-02-05", "1975-11-20"]]
    }, {
        "name": "Felipe Gonzalez",
        "href": "http://www.worldpresidentsdb.com/Felipe-Gonzalez/",
        "rawTerms": [" 1982-12-01 to 1996-05-04"],
        "titleName": "Prime Minister Felipe Gonzalez",
        "terms": [["1982-12-01", "1996-05-04"]]
    }, {
        "name": "Mariano Rajoy",
        "href": "http://www.worldpresidentsdb.com/Mariano-Rajoy/",
        "rawTerms": [" In office since 2011-12-21"],
        "titleName": "Prime Minister Mariano Rajoy",
        "terms": [["2011-12-21", null]]
    }, {
        "name": "Jose Luis Rodriguez Zapatero",
        "href": "http://www.worldpresidentsdb.com/Jose-Luis-Rodriguez-Zapatero/",
        "rawTerms": [" 2004-04-17 to 2011-12-21"],
        "titleName": "Prime Minister Jose Luis Rodriguez Zapatero",
        "terms": [["2004-04-17", "2011-12-21"]]
    }],
    "Ukraine": [{
        "name": "Leonid Kuchma",
        "href": "http://www.worldpresidentsdb.com/Leonid-Kuchma/",
        "rawTerms": [" 1994-07-19 to 2005-01-23"],
        "titleName": "President Leonid Kuchma",
        "terms": [["1994-07-19", "2005-01-23"]]
    }, {
        "name": "Viktor Yuschenko",
        "href": "http://www.worldpresidentsdb.com/Viktor-Yuschenko/",
        "rawTerms": [" 2005-01-23 to 2010-02-25"],
        "titleName": "President Viktor Yuschenko",
        "terms": [["2005-01-23", "2010-02-25"]]
    }, {
        "name": "Viktor Yanukovych",
        "href": "http://www.worldpresidentsdb.com/Viktor-Yanukovych/",
        "rawTerms": [" 2010-02-25 to 2014-02-22"],
        "titleName": "President Viktor Yanukovych",
        "terms": [["2010-02-25", "2014-02-22"]]
    }, {
        "name": "Petro Poroshenko",
        "href": "http://www.worldpresidentsdb.com/Petro-Poroshenko/",
        "rawTerms": [" In office since 2014-06-07"],
        "titleName": "President Petro Poroshenko",
        "terms": [["2014-06-07", null]]
    }],
    "Indonesia": [{
        "name": "Megawati Sukarnoputri",
        "href": "http://www.worldpresidentsdb.com/Megawati-Sukarnoputri/",
        "rawTerms": ["07/23/2001 to 10/20/2004"],
        "titleName": "President Megawati Sukarnoputri",
        "terms": [["2001-07-23", "2004-10-20"]]
    }, {
        "name": "Joko Widodo",
        "href": "http://www.worldpresidentsdb.com/Joko-Widodo/",
        "rawTerms": [" In office since 2014-10-20"],
        "titleName": "President Joko Widodo",
        "terms": [["2014-10-20", null]]
    }, {
        "name": "Susilo Bambang Yudhoyono",
        "href": "http://www.worldpresidentsdb.com/Susilo-Bambang-Yudhoyono/",
        "rawTerms": [" 2004-10-20 to 2014-10-20"],
        "titleName": "President Susilo Bambang Yudhoyono",
        "terms": [["2004-10-20", "2014-10-20"]]
    }],
    "Libya": [{
        "name": "Muammar Gaddafi",
        "href": "http://www.worldpresidentsdb.com/Muammar-Gaddafi/",
        "rawTerms": [" 1969-09-01 to 1977-03-02", " 1977-03-02 to 1979-03-02", " 1979-03-02 to 2011-08-23"],
        "titleName": "Dictator Muammar Gaddafi",
        "terms": [["1969-09-01", "1977-03-02"], ["1977-03-02", "1979-03-02"], ["1979-03-02", "2011-08-23"]]
    }, {
        "name": "Mohammed Magariaf",
        "href": "http://www.worldpresidentsdb.com/Mohammed-Magariaf/",
        "rawTerms": [" 2012-08-09 to 2013-05-28"],
        "titleName": "President Mohammed Magariaf",
        "terms": [["2012-08-09", "2013-05-28"]]
    }, {
        "name": "Mustafa Abdul Jalil",
        "href": "http://www.worldpresidentsdb.com/Mustafa-Abdul-Jalil/",
        "rawTerms": [" 2011-03-05 to 2012-08-08"],
        "titleName": "President Mustafa Abdul Jalil",
        "terms": [["2011-03-05", "2012-08-08"]]
    }],
    "Denmark": [{
        "name": "Anders Fogh Rasmussen",
        "href": "http://www.worldpresidentsdb.com/Anders-Fogh-Rasmussen/",
        "rawTerms": [" 2001-11-27 to 2009-04-05"],
        "titleName": "Prime Minister Anders Fogh Rasmussen",
        "terms": [["2001-11-27", "2009-04-05"]]
    }, {
        "name": "Lars Lokke Rasmussen",
        "href": "http://www.worldpresidentsdb.com/Lars-Lokke-Rasmussen/",
        "rawTerms": [" 2009-04-05 to 2011-10-03"],
        "titleName": "Prime Minister Lars Lokke Rasmussen",
        "terms": [["2009-04-05", "2011-10-03"]]
    }, {
        "name": "Helle Thorning Schmidt",
        "href": "http://www.worldpresidentsdb.com/Helle-Thorning-Schmidt/",
        "rawTerms": [" 2011-10-03 to 2014-02-03", " In office since 2014-02-03"],
        "titleName": "Prime Minister Helle Thorning Schmidt",
        "terms": [["2011-10-03", "2014-02-03"], ["2014-02-03", null]]
    }],
    "Philippines": [{
        "name": "Emilio Aguinaldo",
        "href": "http://www.worldpresidentsdb.com/Emilio-Aguinaldo/",
        "rawTerms": [" 1897-03-22 to 1901-04-01"],
        "titleName": "President Emilio Aguinaldo",
        "terms": [["1897-03-22", "1901-04-01"]]
    }, {
        "name": "Manuel L Quezon",
        "href": "http://www.worldpresidentsdb.com/Manuel-L-Quezon/",
        "rawTerms": [" 1935-11-15 to 1944-08-01"],
        "titleName": "President Manuel L Quezon",
        "terms": [["1935-11-15", "1944-08-01"]]
    }, {
        "name": "Jose P Laurel",
        "href": "http://www.worldpresidentsdb.com/Jose-P-Laurel/",
        "rawTerms": [" 1943-10-14 to 1945-08-17"],
        "titleName": "President Jose P Laurel",
        "terms": [["1943-10-14", "1945-08-17"]]
    }, {
        "name": "Sergio Osmena",
        "href": "http://www.worldpresidentsdb.com/Sergio-Osmena/",
        "rawTerms": [" 1944-08-01 to 1946-05-28"],
        "titleName": "President Sergio Osmena",
        "terms": [["1944-08-01", "1946-05-28"]]
    }, {
        "name": "Manuel Roxas",
        "href": "http://www.worldpresidentsdb.com/Manuel-Roxas/",
        "rawTerms": [" 1946-05-28 to 1948-04-15"],
        "titleName": "President Manuel Roxas",
        "terms": [["1946-05-28", "1948-04-15"]]
    }, {
        "name": "Elpidio Quirino",
        "href": "http://www.worldpresidentsdb.com/Elpidio-Quirino/",
        "rawTerms": [" 1948-04-17 to 1953-12-30"],
        "titleName": "President Elpidio Quirino",
        "terms": [["1948-04-17", "1953-12-30"]]
    }, {
        "name": "Ramon Magsaysay",
        "href": "http://www.worldpresidentsdb.com/Ramon-Magsaysay/",
        "rawTerms": [" 1953-12-30 to 1957-03-17"],
        "titleName": "President Ramon Magsaysay",
        "terms": [["1953-12-30", "1957-03-17"]]
    }, {
        "name": "Carlos P Garcia",
        "href": "http://www.worldpresidentsdb.com/Carlos-P-Garcia/",
        "rawTerms": [" 1957-03-17 to 1961-12-30"],
        "titleName": "President Carlos P Garcia",
        "terms": [["1957-03-17", "1961-12-30"]]
    }, {
        "name": "Diosdado Macapagal",
        "href": "http://www.worldpresidentsdb.com/Diosdado-Macapagal/",
        "rawTerms": [" 1961-12-30 to 1965-12-30"],
        "titleName": "President Diosdado Macapagal",
        "terms": [["1961-12-30", "1965-12-30"]]
    }, {
        "name": "Ferdinand Marcos",
        "href": "http://www.worldpresidentsdb.com/Ferdinand-Marcos/",
        "rawTerms": [" 1965-12-30 to 1986-02-25"],
        "titleName": "President Ferdinand Marcos",
        "terms": [["1965-12-30", "1986-02-25"]]
    }, {
        "name": "Corazon Aquino",
        "href": "http://www.worldpresidentsdb.com/Corazon-Aquino/",
        "rawTerms": [" 1986-02-25 to 1992-06-30"],
        "titleName": "President Corazon Aquino",
        "terms": [["1986-02-25", "1992-06-30"]]
    }, {
        "name": "Fidel V Ramos",
        "href": "http://www.worldpresidentsdb.com/Fidel-V-Ramos/",
        "rawTerms": [" 1992-06-30 to 1998-06-30"],
        "titleName": "President Fidel V Ramos",
        "terms": [["1992-06-30", "1998-06-30"]]
    }, {
        "name": "Joseph Estrada",
        "href": "http://www.worldpresidentsdb.com/Joseph-Estrada/",
        "rawTerms": [" 1998-06-30 to 2001-01-20"],
        "titleName": "President Joseph Estrada",
        "terms": [["1998-06-30", "2001-01-20"]]
    }, {
        "name": "Gloria Macapagal Arroyo",
        "href": "http://www.worldpresidentsdb.com/Gloria-Macapagal-Arroyo/",
        "rawTerms": [" 2001-01-20 to 2010-06-30"],
        "titleName": "President Gloria Macapagal Arroyo",
        "terms": [["2001-01-20", "2010-06-30"]]
    }, {
        "name": "Benigno Aquino III",
        "href": "http://www.worldpresidentsdb.com/Benigno-Aquino-III/",
        "rawTerms": [" In office since 2010-06-30"],
        "titleName": "President Benigno Aquino III",
        "terms": [["2010-06-30", null]]
    }],
    "Finland": [{
        "name": "Martti Ahtisaari",
        "href": "http://www.worldpresidentsdb.com/Martti-Ahtisaari/",
        "rawTerms": [" 1994-03-01 to 2000-03-01"],
        "titleName": "President Martti Ahtisaari",
        "terms": [["1994-03-01", "2000-03-01"]]
    }, {
        "name": "Tarja Halonen",
        "href": "http://www.worldpresidentsdb.com/Tarja-Halonen/",
        "rawTerms": [" 2000-03-01 to 2012-03-01"],
        "titleName": "President Tarja Halonen",
        "terms": [["2000-03-01", "2012-03-01"]]
    }, {
        "name": "Sauli Niinisto",
        "href": "http://www.worldpresidentsdb.com/Sauli-Niinisto/",
        "rawTerms": [" In office since 2012-03-01"],
        "titleName": "President Sauli Niinisto",
        "terms": [["2012-03-01", null]]
    }],
    "Costa-Rica": [{
        "name": "Oscar Arias",
        "href": "http://www.worldpresidentsdb.com/Oscar-Arias/",
        "rawTerms": [" 2006-05-08 to 2010-05-08"],
        "titleName": "President Oscar Arias",
        "terms": [["2006-05-08", "2010-05-08"]]
    }, {
        "name": "Laura Chinchilla",
        "href": "http://www.worldpresidentsdb.com/Laura-Chinchilla/",
        "rawTerms": [" 2010-05-08 to 2014-05-08"],
        "titleName": "President Laura Chinchilla",
        "terms": [["2010-05-08", "2014-05-08"]]
    }, {
        "name": "Abel Pacheco",
        "href": "http://www.worldpresidentsdb.com/Abel-Pacheco/",
        "rawTerms": [" 2002-05-08 to 2006-05-08"],
        "titleName": "President Abel Pacheco",
        "terms": [["2002-05-08", "2006-05-08"]]
    }, {
        "name": "Luis Guillermo Solis",
        "href": "http://www.worldpresidentsdb.com/Luis-Guillermo-Solis/",
        "rawTerms": [" In office since 2014-05-08"],
        "titleName": "President Luis Guillermo Solis",
        "terms": [["2014-05-08", null]]
    }],
    "South-Africa": [{
        "name": "Charles Robberts Swart",
        "href": "http://www.worldpresidentsdb.com/Charles-Robberts-Swart/",
        "rawTerms": [" 1961-05-31 to 1967-06-01"],
        "titleName": "President Charles Robberts Swart",
        "terms": [["1961-05-31", "1967-06-01"]]
    }, {
        "name": "Theophilus Ebenhaezer Donges",
        "href": "http://www.worldpresidentsdb.com/Theophilus-Ebenhaezer-Donges/",
        "rawTerms": [" 1966-09-06 to 1966-09-13"],
        "titleName": "President Theophilus Ebenhaezer Donges",
        "terms": [["1966-09-06", "1966-09-13"]]
    }, {
        "name": "Jozua Francois Naude",
        "href": "http://www.worldpresidentsdb.com/Jozua-Francois-Naude/",
        "rawTerms": [" 1967-06-01 to 1968-04-10"],
        "titleName": "President Jozua Francois Naude",
        "terms": [["1967-06-01", "1968-04-10"]]
    }, {
        "name": "Jacobus Johannes Fouche",
        "href": "http://www.worldpresidentsdb.com/Jacobus-Johannes-Fouche/",
        "rawTerms": [" 1968-04-10 to 1975-04-09"],
        "titleName": "President Jacobus Johannes Fouche",
        "terms": [["1968-04-10", "1975-04-09"]]
    }, {
        "name": "Johannes de Klerk",
        "href": "http://www.worldpresidentsdb.com/Johannes-de-Klerk/",
        "rawTerms": [" 1975-04-09 to 1975-04-19"],
        "titleName": "President Johannes de Klerk",
        "terms": [["1975-04-09", "1975-04-19"]]
    }, {
        "name": "Nicolaas Diederichs",
        "href": "http://www.worldpresidentsdb.com/Nicolaas-Diederichs/",
        "rawTerms": [" 1975-04-19 to 1978-08-21"],
        "titleName": "President Nicolaas Diederichs",
        "terms": [["1975-04-19", "1978-08-21"]]
    }, {
        "name": "B J Vorster",
        "href": "http://www.worldpresidentsdb.com/B-J-Vorster/",
        "rawTerms": [" 1978-10-10 to 1979-06-04"],
        "titleName": "President B J Vorster",
        "terms": [["1978-10-10", "1979-06-04"]]
    }, {
        "name": "Marais Viljoen",
        "href": "http://www.worldpresidentsdb.com/Marais-Viljoen/",
        "rawTerms": [" 1979-06-04 to 1984-09-04", " 1978-08-21 to 1978-10-10"],
        "titleName": "President Marais Viljoen",
        "terms": [["1979-06-04", "1984-09-04"], ["1978-08-21", "1978-10-10"]]
    }, {
        "name": "P W Botha",
        "href": "http://www.worldpresidentsdb.com/P-W-Botha/",
        "rawTerms": [" 1984-09-03 to 1989-08-15"],
        "titleName": "President P W Botha",
        "terms": [["1984-09-03", "1989-08-15"]]
    }, {
        "name": "F W de Klerk",
        "href": "http://www.worldpresidentsdb.com/F-W-de-Klerk/",
        "rawTerms": [" 1989-09-20 to 1994-05-09"],
        "titleName": "President F W de Klerk",
        "terms": [["1989-09-20", "1994-05-09"]]
    }, {
        "name": "Nelson Mandela",
        "href": "http://www.worldpresidentsdb.com/Nelson-Mandela/",
        "rawTerms": [" 1994-04-27 to 1999-06-14"],
        "titleName": "President Nelson Mandela",
        "terms": [["1994-04-27", "1999-06-14"]]
    }, {
        "name": "Thabo Mbeki",
        "href": "http://www.worldpresidentsdb.com/Thabo-Mbeki/",
        "rawTerms": [" 1999-06-16 to 2008-09-24"],
        "titleName": "President Thabo Mbeki",
        "terms": [["1999-06-16", "2008-09-24"]]
    }, {
        "name": "Kgalema Motlanthe",
        "href": "http://www.worldpresidentsdb.com/Kgalema-Motlanthe/",
        "rawTerms": [" 2008-09-25 to 2009-05-09"],
        "titleName": "President Kgalema Motlanthe",
        "terms": [["2008-09-25", "2009-05-09"]]
    }, {
        "name": "Jacob Zuma",
        "href": "http://www.worldpresidentsdb.com/Jacob-Zuma/",
        "rawTerms": [" In office since 2009-05-09"],
        "titleName": "President Jacob Zuma",
        "terms": [["2009-05-09", null]]
    }],
    "South-Korea": [{
        "name": "Kim Young sam",
        "href": "http://www.worldpresidentsdb.com/Kim-Young-sam/",
        "rawTerms": ["25 February 1993 \u0096 25 February 1998"],
        "titleName": "President Kim Young sam",
        "terms": [["1993-02-25", "1998-02-25"]]
    }, {
        "name": "Kim Dae jung",
        "href": "http://www.worldpresidentsdb.com/Kim-Dae-jung/",
        "rawTerms": ["25 February 1998 \u0096 25 February 2003"],
        "titleName": "President Kim Dae jung",
        "terms": [["1998-02-25", "2003-02-25"]]
    }, {
        "name": "Roh Moo hyun",
        "href": "http://www.worldpresidentsdb.com/Roh-Moo-hyun/",
        "rawTerms": ["25 February 2003 \u0096 25 February 2008"],
        "titleName": "President Roh Moo hyun",
        "terms": [["2003-02-25", "2008-02-25"]]
    }, {
        "name": "Lee Myung bak",
        "href": "http://www.worldpresidentsdb.com/Lee-Myung-bak/",
        "rawTerms": ["17th President of South Korea from 02/25/2008"],
        "titleName": "President Lee Myung bak",
        "terms": [["2008-02-25", null]]
    }, {
        "name": "Park Geun hye",
        "href": "http://www.worldpresidentsdb.com/Park-Geun-hye/",
        "rawTerms": [" In office since 2013-02-25"],
        "titleName": "President Park Geun hye",
        "terms": [["2013-02-25", null]]
    }],
    "Sweden": [{
        "name": "Stefan Lofven",
        "href": "http://www.worldpresidentsdb.com/Stefan-Lofven/",
        "rawTerms": [" In office since 2014-10-03"],
        "titleName": "Prime Minister Stefan Lofven",
        "terms": [["2014-10-03", null]]
    }, {
        "name": "Goran Persson",
        "href": "http://www.worldpresidentsdb.com/Goran-Persson/",
        "rawTerms": ["03/22/1996 to 10/06/2006"],
        "titleName": "Prime Minister Goran Persson",
        "terms": [["1996-03-22", "2006-10-06"]]
    }, {
        "name": "Fredrik Reinfeldt",
        "href": "http://www.worldpresidentsdb.com/Fredrik-Reinfeldt/",
        "rawTerms": [" 2006-10-06 to 2014-10-03"],
        "titleName": "Prime Minister Fredrik Reinfeldt",
        "terms": [["2006-10-06", "2014-10-03"]]
    }],
    "Uruguay": [{
        "name": "Jose Mujica",
        "href": "http://www.worldpresidentsdb.com/Jose-Mujica/",
        "rawTerms": [" In office since 2010-03-01"],
        "titleName": "President Jose Mujica",
        "terms": [["2010-03-01", null]]
    }, {
        "name": "Julio Maria Sanguinetti Coirolo",
        "href": "http://www.worldpresidentsdb.com/Julio-Maria-Sanguinetti-Coirolo/",
        "rawTerms": ["03/01/1985 to 03/01/1990\r\n03/01/1995 to 03/01/2000"],
        "titleName": "President Julio Maria Sanguinetti Coirolo",
        "terms": [["1985-03-01", "1990-03-01"]]
    }, {
        "name": "Tabare Vazquez",
        "href": "http://www.worldpresidentsdb.com/Tabare-Vazquez/",
        "rawTerms": [" 2005-03-01 to 2010-03-01"],
        "titleName": "President Tabare Vazquez",
        "terms": [["2005-03-01", "2010-03-01"]]
    }],
    "Czech-Republic": [{
        "name": "Vaclav Havel",
        "href": "http://www.worldpresidentsdb.com/Vaclav-Havel/",
        "rawTerms": [" 1993-02-02 to 2003-02-02"],
        "titleName": "President Vaclav Havel",
        "terms": [["1993-02-02", "2003-02-02"]]
    }, {
        "name": "Vaclav Klaus",
        "href": "http://www.worldpresidentsdb.com/Vaclav-Klaus/",
        "rawTerms": [" 2003-03-07 to 2013-03-07"],
        "titleName": "President Vaclav Klaus",
        "terms": [["2003-03-07", "2013-03-07"]]
    }, {
        "name": "Milos Zeman",
        "href": "http://www.worldpresidentsdb.com/Milos-Zeman/",
        "rawTerms": [" In office since 2013-03-08"],
        "titleName": "President Milos Zeman",
        "terms": [["2013-03-08", null]]
    }],
    "Hungary": [{
        "name": "Arpad Goncz",
        "href": "http://www.worldpresidentsdb.com/Arpad-Goncz/",
        "rawTerms": [" 1990-08-04 to 2000-08-04"],
        "titleName": "President Arpad Goncz",
        "terms": [["1990-08-04", "2000-08-04"]]
    }, {
        "name": "Ferenc Madl",
        "href": "http://www.worldpresidentsdb.com/Ferenc-Madl/",
        "rawTerms": [" 2000-08-04 to 2005-08-05"],
        "titleName": "President Ferenc Madl",
        "terms": [["2000-08-04", "2005-08-05"]]
    }, {
        "name": "Janos Ader",
        "href": "http://www.worldpresidentsdb.com/Janos-Ader/",
        "rawTerms": [" In office since 2012-05-10"],
        "titleName": "President Janos Ader",
        "terms": [["2012-05-10", null]]
    }],
    "Switzerland": [{
        "name": "Didier Burkhalter",
        "href": "http://www.worldpresidentsdb.com/Didier-Burkhalter/",
        "rawTerms": [" In office since 2014-01-01"],
        "titleName": "President Didier Burkhalter",
        "terms": [["2014-01-01", null]]
    }, {
        "name": "Micheline Calmy Rey",
        "href": "http://www.worldpresidentsdb.com/Micheline-Calmy-Rey/",
        "rawTerms": [" 2007-01-01 to 2008-01-01", " 2011-01-01 to 2011-12-31"],
        "titleName": "President Micheline Calmy Rey",
        "terms": [["2007-01-01", "2008-01-01"], ["2011-01-01", "2011-12-31"]]
    }, {
        "name": "Pascal Couchepin",
        "href": "http://www.worldpresidentsdb.com/Pascal-Couchepin/",
        "rawTerms": [" 2008-01-01 to 2008-12-31", " 1998-01-01 to 2009-11-01", " 2003-01-01 to 2003-12-31"],
        "titleName": "President Pascal Couchepin",
        "terms": [["2008-01-01", "2008-12-31"], ["1998-01-01", "2009-11-01"], ["2003-01-01", "2003-12-31"]]
    }, {
        "name": "Moritz Leuenberger",
        "href": "http://www.worldpresidentsdb.com/Moritz-Leuenberger/",
        "rawTerms": [" 2001-01-01 to 2002-01-01", " 2006-01-01 to 2007-01-01"],
        "titleName": "President Moritz Leuenberger",
        "terms": [["2001-01-01", "2002-01-01"], ["2006-01-01", "2007-01-01"]]
    }, {
        "name": "Ueli Maurer",
        "href": "http://www.worldpresidentsdb.com/Ueli-Maurer/",
        "rawTerms": [" 2013-01-10 to 2013-12-31"],
        "titleName": "President Ueli Maurer",
        "terms": [["2013-01-10", "2013-12-31"]]
    }, {
        "name": "Samuel Schmid",
        "href": "http://www.worldpresidentsdb.com/Samuel-Schmid/",
        "rawTerms": ["01/01/2005 to 01/01/2006"],
        "titleName": "President Samuel Schmid",
        "terms": [["2005-01-01", "2006-01-01"]]
    }],
    "Syria": [{
        "name": "Nazim al Kudsi",
        "href": "http://www.worldpresidentsdb.com/Nazim-al-Kudsi/",
        "rawTerms": [" 1961-12-12 to 1963-03-07"],
        "titleName": "President Nazim al Kudsi",
        "terms": [["1961-12-12", "1963-03-07"]]
    }, {
        "name": "Hafez al Assad",
        "href": "http://www.worldpresidentsdb.com/Hafez-al-Assad/",
        "rawTerms": [" 1971-03-12 to 2000-06-10"],
        "titleName": "President Hafez al Assad",
        "terms": [["1971-03-12", "2000-06-10"]]
    }, {
        "name": "Bashar al Assad",
        "href": "http://www.worldpresidentsdb.com/Bashar-al-Assad/",
        "rawTerms": [" In office since 2000-07-17"],
        "titleName": "Dictator Bashar al Assad",
        "terms": [["2000-07-17", null]]
    }],
    "New-Zealand": [{
        "name": "Henry Sewell",
        "href": "http://www.worldpresidentsdb.com/Henry-Sewell/",
        "rawTerms": [" 1856-05-07 to 1856-05-20"],
        "titleName": "Prime Minister Henry Sewell",
        "terms": [["1856-05-07", "1856-05-20"]]
    }, {
        "name": "William Fox",
        "href": "http://www.worldpresidentsdb.com/William-Fox/",
        "rawTerms": [" 1856-05-20 to 1856-06-02", " 1861-07-12 to 1862-08-06", " 1869-06-28 to 1872-09-10", " 1873-03-03 to 1873-04-08"],
        "titleName": "Prime Minister William Fox",
        "terms": [["1856-05-20", "1856-06-02"], ["1861-07-12", "1862-08-06"], ["1869-06-28", "1872-09-10"], ["1873-03-03", "1873-04-08"]]
    }, {
        "name": "Edward Stafford",
        "href": "http://www.worldpresidentsdb.com/Edward-Stafford/",
        "rawTerms": [" 1856-06-02 to 1861-07-12", " 1865-10-16 to 1869-06-28", " 1872-09-10 to 1872-10-11"],
        "titleName": "Prime Minister Edward Stafford",
        "terms": [["1856-06-02", "1861-07-12"], ["1865-10-16", "1869-06-28"], ["1872-09-10", "1872-10-11"]]
    }, {
        "name": "Alfred Domett",
        "href": "http://www.worldpresidentsdb.com/Alfred-Domett/",
        "rawTerms": [" 1862-08-06 to 1863-10-30"],
        "titleName": "Prime Minister Alfred Domett",
        "terms": [["1862-08-06", "1863-10-30"]]
    }, {
        "name": "Frederick Whitaker",
        "href": "http://www.worldpresidentsdb.com/Frederick-Whitaker/",
        "rawTerms": [" 1863-10-30 to 1864-11-24", " 1882-04-21 to 1883-09-25"],
        "titleName": "Prime Minister Frederick Whitaker",
        "terms": [["1863-10-30", "1864-11-24"], ["1882-04-21", "1883-09-25"]]
    }, {
        "name": "Frederick Weld",
        "href": "http://www.worldpresidentsdb.com/Frederick-Weld/",
        "rawTerms": [" 1864-11-24 to 1865-10-16"],
        "titleName": "Prime Minister Frederick Weld",
        "terms": [["1864-11-24", "1865-10-16"]]
    }, {
        "name": "George Marsden Waterhouse",
        "href": "http://www.worldpresidentsdb.com/George-Marsden-Waterhouse/",
        "rawTerms": [" 1872-10-11 to 1873-03-03"],
        "titleName": "Prime Minister George Marsden Waterhouse",
        "terms": [["1872-10-11", "1873-03-03"]]
    }, {
        "name": "Julius Vogel",
        "href": "http://www.worldpresidentsdb.com/Julius-Vogel/",
        "rawTerms": [" 1873-04-08 to 1875-07-06", " 1876-02-15 to 1876-09-01"],
        "titleName": "Prime Minister Julius Vogel",
        "terms": [["1873-04-08", "1875-07-06"], ["1876-02-15", "1876-09-01"]]
    }, {
        "name": "Daniel Pollen",
        "href": "http://www.worldpresidentsdb.com/Daniel-Pollen/",
        "rawTerms": [" 1875-07-06 to 1876-02-15"],
        "titleName": "Prime Minister Daniel Pollen",
        "terms": [["1875-07-06", "1876-02-15"]]
    }, {
        "name": "Harry Atkinson",
        "href": "http://www.worldpresidentsdb.com/Harry-Atkinson/",
        "rawTerms": [" 1876-09-01 to 1877-10-13", " 1883-09-25 to 1884-08-16", " 1884-08-28 to 1884-09-03", " 1887-10-08 to 1891-01-24"],
        "titleName": "Prime Minister Harry Atkinson",
        "terms": [["1876-09-01", "1877-10-13"], ["1883-09-25", "1884-08-16"], ["1884-08-28", "1884-09-03"], ["1887-10-08", "1891-01-24"]]
    }, {
        "name": "George Grey",
        "href": "http://www.worldpresidentsdb.com/George-Grey/",
        "rawTerms": [" 1877-10-13 to 1879-10-08"],
        "titleName": "Prime Minister George Grey",
        "terms": [["1877-10-13", "1879-10-08"]]
    }, {
        "name": "John Hall",
        "href": "http://www.worldpresidentsdb.com/John-Hall/",
        "rawTerms": [" 1879-10-08 to 1882-04-21"],
        "titleName": "Prime Minister John Hall",
        "terms": [["1879-10-08", "1882-04-21"]]
    }, {
        "name": "Robert Stout",
        "href": "http://www.worldpresidentsdb.com/Robert-Stout/",
        "rawTerms": [" 1884-08-16 to 1884-08-28", " 1884-09-03 to 1887-10-08"],
        "titleName": "Prime Minister Robert Stout",
        "terms": [["1884-08-16", "1884-08-28"], ["1884-09-03", "1887-10-08"]]
    }, {
        "name": "John Ballance",
        "href": "http://www.worldpresidentsdb.com/John-Ballance/",
        "rawTerms": [" 1891-01-24 to 1893-04-27"],
        "titleName": "Prime Minister John Ballance",
        "terms": [["1891-01-24", "1893-04-27"]]
    }, {
        "name": "Richard Seddon",
        "href": "http://www.worldpresidentsdb.com/Richard-Seddon/",
        "rawTerms": [" 1893-04-27 to 1906-06-10"],
        "titleName": "Prime Minister Richard Seddon",
        "terms": [["1893-04-27", "1906-06-10"]]
    }, {
        "name": "William Hall Jones",
        "href": "http://www.worldpresidentsdb.com/William-Hall-Jones/",
        "rawTerms": [" 1906-06-10 to 1906-08-06"],
        "titleName": "Prime Minister William Hall Jones",
        "terms": [["1906-06-10", "1906-08-06"]]
    }, {
        "name": "Joseph Ward",
        "href": "http://www.worldpresidentsdb.com/Joseph-Ward/",
        "rawTerms": [" 1906-08-06 to 1912-03-28", " 1928-12-10 to 1930-05-28"],
        "titleName": "Prime Minister Joseph Ward",
        "terms": [["1906-08-06", "1912-03-28"], ["1928-12-10", "1930-05-28"]]
    }, {
        "name": "Thomas Mackenzie",
        "href": "http://www.worldpresidentsdb.com/Thomas-Mackenzie/",
        "rawTerms": [" 1912-03-28 to 1912-07-10"],
        "titleName": "Prime Minister Thomas Mackenzie",
        "terms": [["1912-03-28", "1912-07-10"]]
    }, {
        "name": "William Massey",
        "href": "http://www.worldpresidentsdb.com/William-Massey/",
        "rawTerms": [" 1912-07-10 to 1925-05-10"],
        "titleName": "Prime Minister William Massey",
        "terms": [["1912-07-10", "1925-05-10"]]
    }, {
        "name": "Francis Bell",
        "href": "http://www.worldpresidentsdb.com/Francis-Bell/",
        "rawTerms": [" 1925-05-10 to 1925-05-30"],
        "titleName": "Prime Minister Francis Bell",
        "terms": [["1925-05-10", "1925-05-30"]]
    }, {
        "name": "Gordon Coates",
        "href": "http://www.worldpresidentsdb.com/Gordon-Coates/",
        "rawTerms": [" 1925-05-30 to 1928-12-10"],
        "titleName": "Prime Minister Gordon Coates",
        "terms": [["1925-05-30", "1928-12-10"]]
    }, {
        "name": "George Forbes",
        "href": "http://www.worldpresidentsdb.com/George-Forbes/",
        "rawTerms": [" 1930-05-28 to 1935-12-06"],
        "titleName": "Prime Minister George Forbes",
        "terms": [["1930-05-28", "1935-12-06"]]
    }, {
        "name": "Michael Savage",
        "href": "http://www.worldpresidentsdb.com/Michael-Savage/",
        "rawTerms": ["6 December 1935 \u0096 27 March 1940"],
        "titleName": "Prime Minister Michael Savage",
        "terms": [["1935-12-06", "1940-03-27"]]
    }, {
        "name": "Peter Fraser",
        "href": "http://www.worldpresidentsdb.com/Peter-Fraser/",
        "rawTerms": ["27 March 1940 \u0096 December 13, 1949"],
        "titleName": "Prime Minister Peter Fraser",
        "terms": [["1940-03-27", "1949-12-13"]]
    }, {
        "name": "Sidney Holland",
        "href": "http://www.worldpresidentsdb.com/Sidney-Holland/",
        "rawTerms": [" 1949-12-13 to 1957-09-20"],
        "titleName": "Prime Minister Sidney Holland",
        "terms": [["1949-12-13", "1957-09-20"]]
    }, {
        "name": "Keith Holyoake",
        "href": "http://www.worldpresidentsdb.com/Keith-Holyoake/",
        "rawTerms": ["20 September 1957 \u0096 12 December 1957\r\n12 December 1960 \u0096 7 February 1972"],
        "titleName": "Prime Minister Keith Holyoake",
        "terms": [["1957-09-20", "1957-12-12"], ["1960-12-12", "1972-02-07"]]
    }, {
        "name": "Walter Nash",
        "href": "http://www.worldpresidentsdb.com/Walter-Nash/",
        "rawTerms": [" 1957-12-12 to 1960-12-12"],
        "titleName": "Prime Minister Walter Nash",
        "terms": [["1957-12-12", "1960-12-12"]]
    }, {
        "name": "Jack Marshall",
        "href": "http://www.worldpresidentsdb.com/Jack-Marshall/",
        "rawTerms": [" 1972-02-07 to 1972-12-00"],
        "titleName": "Prime Minister Jack Marshall",
        "terms": [["1972-02-07", "1972-12-08"]]
    }, {
        "name": "Norman Kirk",
        "href": "http://www.worldpresidentsdb.com/Norman-Kirk/",
        "rawTerms": [" 1972-12-08 to 1974-08-31"],
        "titleName": "Prime Minister Norman Kirk",
        "terms": [["1972-12-08", "1974-08-31"]]
    }, {
        "name": "Bill Rowling",
        "href": "http://www.worldpresidentsdb.com/Bill-Rowling/",
        "rawTerms": [" 1974-09-06 to 1975-12-12"],
        "titleName": "Prime Minister Bill Rowling",
        "terms": [["1974-09-06", "1975-12-12"]]
    }, {
        "name": "Robert Muldoon",
        "href": "http://www.worldpresidentsdb.com/Robert-Muldoon/",
        "rawTerms": ["12 December 1975 \u0096 26 July 1984"],
        "titleName": "Prime Minister Robert Muldoon",
        "terms": [["1975-12-12", "1984-07-26"]]
    }, {
        "name": "David Lange",
        "href": "http://www.worldpresidentsdb.com/David-Lange/",
        "rawTerms": ["26 July 1984 to 8 August 1989"],
        "titleName": "Prime Minister David Lange",
        "terms": [["1984-07-26", "1989-08-08"]]
    }, {
        "name": "Geoffrey Palmer",
        "href": "http://www.worldpresidentsdb.com/Geoffrey-Palmer/",
        "rawTerms": ["8 August 1989 to 4 September 1990"],
        "titleName": "Prime Minister Geoffrey Palmer",
        "terms": [["1989-08-08", "1990-09-04"]]
    }, {
        "name": "Mike Moore",
        "href": "http://www.worldpresidentsdb.com/Mike-Moore/",
        "rawTerms": [" 1990-09-04 to 1990-11-02"],
        "titleName": "Prime Minister Mike Moore",
        "terms": [["1990-09-04", "1990-11-02"]]
    }, {
        "name": "Jim Bolger",
        "href": "http://www.worldpresidentsdb.com/Jim-Bolger/",
        "rawTerms": ["2 November 1990 to 8 December 1997"],
        "titleName": "Prime Minister Jim Bolger",
        "terms": [["1990-11-02", "1991-12-08"]]
    }, {
        "name": "Jenny Shipley",
        "href": "http://www.worldpresidentsdb.com/Jenny-Shipley/",
        "rawTerms": ["8 December 1997 to 5 December 1999"],
        "titleName": "Prime Minister Jenny Shipley",
        "terms": [["1997-12-08", "1999-12-05"]]
    }, {
        "name": "Helen Clark",
        "href": "http://www.worldpresidentsdb.com/Helen-Clark/",
        "rawTerms": [" 1999-12-05 to 2008-11-19"],
        "titleName": "Prime Minister Helen Clark",
        "terms": [["1999-12-05", "2008-11-19"]]
    }, {
        "name": "John Key",
        "href": "http://www.worldpresidentsdb.com/John-Key/",
        "rawTerms": [" In office since 2008-11-19"],
        "titleName": "Prime Minister John Key",
        "terms": [["2008-11-19", null]]
    }],
    "Pakistan": [{
        "name": "Iskander Mirza",
        "href": "http://www.worldpresidentsdb.com/Iskander-Mirza/",
        "rawTerms": [" 1956-03-23 to 1958-10-27"],
        "titleName": "President Iskander Mirza",
        "terms": [["1956-03-23", "1958-10-27"]]
    }, {
        "name": "Pervez Musharraf",
        "href": "http://www.worldpresidentsdb.com/Pervez-Musharraf/",
        "rawTerms": [" 2001-06-20 to 2008-08-18"],
        "titleName": "President Pervez Musharraf",
        "terms": [["2001-06-20", "2008-08-18"]]
    }, {
        "name": "Asif Ali Zardari",
        "href": "http://www.worldpresidentsdb.com/Asif-Ali-Zardari/",
        "rawTerms": [" 2008-09-09 to 2013-09-08"],
        "titleName": "President Asif Ali Zardari",
        "terms": [["2008-09-09", "2013-09-08"]]
    }, {
        "name": "Mamnoon Hussain",
        "href": "http://www.worldpresidentsdb.com/Mamnoon-Hussain/",
        "rawTerms": [" In office since 2013-09-09"],
        "titleName": "President Mamnoon Hussain",
        "terms": [["2013-09-09", null]]
    }],
    "Romania": [{
        "name": "Traian Basescu",
        "href": "http://www.worldpresidentsdb.com/Traian-Basescu/",
        "rawTerms": [" In office since 2012-08-27", " 2007-05-23 to 2012-07-10", " 2004-12-20 to 2007-04-20"],
        "titleName": "President Traian Basescu",
        "terms": [["2012-08-27", null], ["2007-05-23", "2012-07-10"], ["2004-12-20", "2007-04-20"]]
    }, {
        "name": "Ion Iliescu",
        "href": "http://www.worldpresidentsdb.com/Ion-Iliescu/",
        "rawTerms": [" 1990-05-20 to 1992-10-11", " 1992-10-11 to 1996-11-29", " 2000-12-20 to 2004-12-22"],
        "titleName": "President Ion Iliescu",
        "terms": [["1990-05-20", "1992-10-11"], ["1992-10-11", "1996-11-29"], ["2000-12-20", "2004-12-22"]]
    }],
    "Portugal": [{
        "name": "Jorge Sampaio",
        "href": "http://www.worldpresidentsdb.com/Jorge-Sampaio/",
        "rawTerms": [" 1996-03-09 to 2001-03-09", " 2001-03-09 to 2006-03-09"],
        "titleName": "President Jorge Sampaio",
        "terms": [["1996-03-09", "2001-03-09"], ["2001-03-09", "2006-03-09"]]
    }, {
        "name": "Anibal Cavaco Silva",
        "href": "http://www.worldpresidentsdb.com/Anibal-Cavaco-Silva/",
        "rawTerms": [" 2006-03-09 to 2011-03-09", " In office since 2011-03-09"],
        "titleName": "President Anibal Cavaco Silva",
        "terms": [["2006-03-09", "2011-03-09"], ["2011-03-09", null]]
    }, {
        "name": "Mario Soares",
        "href": "http://www.worldpresidentsdb.com/Mario-Soares/",
        "rawTerms": ["03/09/1986 to 03/09/1996"],
        "titleName": "President Mario Soares",
        "terms": [["1986-03-09", "1996-03-09"]]
    }],
    "Mexico": [{
        "name": "Felipe Calderon",
        "href": "http://www.worldpresidentsdb.com/Felipe-Calderon/",
        "rawTerms": [" 2006-12-01 to 2012-11-30"],
        "titleName": "President Felipe Calderon",
        "terms": [["2006-12-01", "2012-11-30"]]
    }, {
        "name": "Miguel de la Madrid",
        "href": "http://www.worldpresidentsdb.com/Miguel-de-la-Madrid/",
        "rawTerms": [" 1982-12-01 to 1988-12-01"],
        "titleName": "President Miguel de la Madrid",
        "terms": [["1982-12-01", "1988-12-01"]]
    }, {
        "name": "Vicente Fox",
        "href": "http://www.worldpresidentsdb.com/Vicente-Fox/",
        "rawTerms": [" 2000-12-01 to 2006-12-01"],
        "titleName": "President Vicente Fox",
        "terms": [["2000-12-01", "2006-12-01"]]
    }, {
        "name": "Enrique Pena Nieto",
        "href": "http://www.worldpresidentsdb.com/Enrique-Pena-Nieto/",
        "rawTerms": [" In office since 2012-12-01"],
        "titleName": "President Enrique Pena Nieto",
        "terms": [["2012-12-01", null]]
    }, {
        "name": "Carlos Salinas",
        "href": "http://www.worldpresidentsdb.com/Carlos-Salinas/",
        "rawTerms": ["12/01/1988 to 12/01/1994"],
        "titleName": "President Carlos Salinas",
        "terms": [["1988-12-01", "1994-12-01"]]
    }, {
        "name": "Ernesto Zedillo",
        "href": "http://www.worldpresidentsdb.com/Ernesto-Zedillo/",
        "rawTerms": ["12/01/1994 to 12/01/2000"],
        "titleName": "President Ernesto Zedillo",
        "terms": [["1994-12-01", "2000-12-01"]]
    }],
    "Egypt": [{
        "name": "Anwar Al Sadat",
        "href": "http://www.worldpresidentsdb.com/Anwar-Al-Sadat/",
        "rawTerms": ["10/05/1970 to 10/06/1981"],
        "titleName": "President Anwar Al Sadat",
        "terms": [["1970-10-05", "1981-10-06"]]
    }, {
        "name": "Abdel Fattah el Sisi",
        "href": "http://www.worldpresidentsdb.com/Abdel-Fattah-el-Sisi/",
        "rawTerms": [" In office since 2014-06-08"],
        "titleName": "President Abdel Fattah el Sisi",
        "terms": [["2014-06-08", null]]
    }, {
        "name": "Mohamed Morsi",
        "href": "http://www.worldpresidentsdb.com/Mohamed-Morsi/",
        "rawTerms": [" 2012-06-30 to 2013-07-03"],
        "titleName": "President Mohamed Morsi",
        "terms": [["2012-06-30", "2013-07-03"]]
    }, {
        "name": "Hosni Mubarak",
        "href": "http://www.worldpresidentsdb.com/Hosni-Mubarak/",
        "rawTerms": [" 1981-10-14 to 1987-10-14", " 1987-10-14 to 1993-10-14", " 1993-10-14 to 1999-10-14", " 1999-10-14 to 2005-10-14", " 2005-10-14 to 2011-02-11"],
        "titleName": "Dictator Hosni Mubarak",
        "terms": [["1981-10-14", "1987-10-14"], ["1987-10-14", "1993-10-14"], ["1993-10-14", "1999-10-14"], ["1999-10-14", "2005-10-14"], ["2005-10-14", "2011-02-11"]]
    }, {
        "name": "Muhammad Naguib",
        "href": "http://www.worldpresidentsdb.com/Muhammad-Naguib/",
        "rawTerms": ["06/18/1953 to 11/14/1954"],
        "titleName": "President Muhammad Naguib",
        "terms": [["1953-06-18", "1954-11-14"]]
    }, {
        "name": "Gamal Abdel Nasser",
        "href": "http://www.worldpresidentsdb.com/Gamal-Abdel-Nasser/",
        "rawTerms": ["01/16/1956 to 09/28/1970"],
        "titleName": "President Gamal Abdel Nasser",
        "terms": [["1956-01-16", "1970-09-28"]]
    }],
    "Singapore": [{
        "name": "Yusof bin Ishak",
        "href": "http://www.worldpresidentsdb.com/Yusof-bin-Ishak/",
        "rawTerms": [" 1965-08-09 to 1970-11-23"],
        "titleName": "President Yusof bin Ishak",
        "terms": [["1965-08-09", "1970-11-23"]]
    }, {
        "name": "Benjamin Sheares",
        "href": "https://en.wikipedia.org/wiki/Benjamin_Sheares",
        "rawTerms": ["2 January 1971  12 May 1981"],
        "titleName": "President Benjamin Sheares",
        "terms": [["1971-01-02","1981-05-12"]]
    }, {
        "name": "Devan Nair",
        "href": "http://www.worldpresidentsdb.com/Devan-Nair/",
        "rawTerms": [" 1981-10-23 to 1985-03-27"],
        "titleName": "President Devan Nair",
        "terms": [["1981-10-23", "1985-03-27"]]
    }, {
        "name": "Wee Kim Wee",
        "href": "http://www.worldpresidentsdb.com/Wee-Kim-Wee/",
        "rawTerms": [" 1985-09-02 to 1993-09-01"],
        "titleName": "President Wee Kim Wee",
        "terms": [["1985-09-02", "1993-09-01"]]
    }, {
        "name": "Ong Teng Cheong",
        "href": "http://www.worldpresidentsdb.com/Ong-Teng-Cheong/",
        "rawTerms": [" 1993-09-01 to 1999-08-31"],
        "titleName": "President Ong Teng Cheong",
        "terms": [["1993-09-01", "1999-08-31"]]
    }, {
        "name": "S R Nathan",
        "href": "http://www.worldpresidentsdb.com/S-R-Nathan/",
        "rawTerms": [" 1999-09-01 to 2011-08-31"],
        "titleName": "President S R Nathan",
        "terms": [["1999-09-01", "2011-08-31"]]
    }, {
        "name": "Tony Tan",
        "href": "http://www.worldpresidentsdb.com/Tony-Tan/",
        "rawTerms": [" In office since 2011-09-01"],
        "titleName": "President Tony Tan",
        "terms": [["2011-09-01", null]]
    }],
    "India": [{
        "name": "Rajendra Prasad",
        "href": "http://www.worldpresidentsdb.com/Rajendra-Prasad/",
        "rawTerms": [" 1950-01-26 to 1962-05-13"],
        "titleName": "President Rajendra Prasad",
        "terms": [["1950-01-26", "1962-05-13"]]
    }, {
        "name": "Sarvepalli Radhakrishnan",
        "href": "http://www.worldpresidentsdb.com/Sarvepalli-Radhakrishnan/",
        "rawTerms": [" 1962-05-13 to 1967-05-13"],
        "titleName": "President Sarvepalli Radhakrishnan",
        "terms": [["1962-05-13", "1967-05-13"]]
    }, {
        "name": "Zakir Hussain",
        "href": "http://www.worldpresidentsdb.com/Zakir-Hussain/",
        "rawTerms": [" 1967-05-13 to 1969-05-03"],
        "titleName": "President Zakir Hussain",
        "terms": [["1967-05-13", "1969-05-03"]]
    }, {
        "name": "V V Giri",
        "href": "http://www.worldpresidentsdb.com/V-V-Giri/",
        "rawTerms": [" 1969-08-24 to 1974-08-24"],
        "titleName": "President V V Giri",
        "terms": [["1969-08-24", "1974-08-24"]]
    }, {
        "name": "Fakhruddin Ali Ahmed",
        "href": "http://www.worldpresidentsdb.com/Fakhruddin-Ali-Ahmed/",
        "rawTerms": [" 1974-08-24 to 1977-02-11"],
        "titleName": "President Fakhruddin Ali Ahmed",
        "terms": [["1974-08-24", "1977-02-11"]]
    }, {
        "name": "Neelam Sanjiva Reddy",
        "href": "http://www.worldpresidentsdb.com/Neelam-Sanjiva-Reddy/",
        "rawTerms": [" 1977-07-25 to 1982-07-25"],
        "titleName": "President Neelam Sanjiva Reddy",
        "terms": [["1977-07-25", "1982-07-25"]]
    }, {
        "name": "Zail Singh",
        "href": "http://www.worldpresidentsdb.com/Zail-Singh/",
        "rawTerms": [" 1982-07-25 to 1987-07-25"],
        "titleName": "President Zail Singh",
        "terms": [["1982-07-25", "1987-07-25"]]
    }, {
        "name": "Ramaswamy Venkataraman",
        "href": "http://www.worldpresidentsdb.com/Ramaswamy-Venkataraman/",
        "rawTerms": [" 1987-07-25 to 1992-07-25"],
        "titleName": "President Ramaswamy Venkataraman",
        "terms": [["1987-07-25", "1992-07-25"]]
    }, {
        "name": "Shankar Dayal Sharma",
        "href": "http://www.worldpresidentsdb.com/Shankar-Dayal-Sharma/",
        "rawTerms": [" 1992-07-25 to 1997-07-25"],
        "titleName": "President Shankar Dayal Sharma",
        "terms": [["1992-07-25", "1997-07-25"]]
    }, {
        "name": "K R Narayanan",
        "href": "http://www.worldpresidentsdb.com/K-R-Narayanan/",
        "rawTerms": [" 1997-07-25 to 2002-07-25"],
        "titleName": "President K R Narayanan",
        "terms": [["1997-07-25", "2002-07-25"]]
    }, {
        "name": "Abdul Kalam",
        "href": "http://www.worldpresidentsdb.com/Abdul-Kalam/",
        "rawTerms": [" 2002-07-25 to 2007-07-25"],
        "titleName": "President Abdul Kalam",
        "terms": [["2002-07-25", "2007-07-25"]]
    }, {
        "name": "Pratibha Patil",
        "href": "http://www.worldpresidentsdb.com/Pratibha-Patil/",
        "rawTerms": [" 2007-07-25 to 2012-07-25"],
        "titleName": "President Pratibha Patil",
        "terms": [["2007-07-25", "2012-07-25"]]
    }, {
        "name": "Pranab Mukherjee",
        "href": "http://www.worldpresidentsdb.com/Pranab-Mukherjee/",
        "rawTerms": [" In office since 2012-07-25"],
        "titleName": "President Pranab Mukherjee",
        "terms": [["2012-07-25", null]]
    }],
    "Russian-Federation": [{
        "name": "Lenin",
        "href": "http://www.worldpresidentsdb.com/Lenin/",
        "rawTerms": [" 1917-11-08 to 1924-01-21"],
        "titleName": "President Lenin",
        "terms": [["1917-11-08", "1924-01-21"]]
    }, {
        "name": "Stalin",
        "href": "http://www.worldpresidentsdb.com/Stalin/",
        "rawTerms": [" 1922-04-03 to 1953-03-05"],
        "titleName": "General Secretary Stalin",
        "terms": [["1922-04-03", "1953-03-05"]]
    }, {
        "name": "Boris Yeltsin",
        "href": "http://www.worldpresidentsdb.com/Boris-Yeltsin/",
        "rawTerms": ["07/10/1931 to 12/31/1999"],
        "titleName": "President Boris Yeltsin",
        "terms": [["1931-07-10", "1999-12-31"]]
    }, {
        "name": "Vladimir Putin",
        "href": "http://www.worldpresidentsdb.com/Vladimir-Putin/",
        "rawTerms": [" 1999-12-31 to 2000-05-07", " 2000-05-07 to 2008-05-07", " In office since 2012-05-07"],
        "titleName": "President Vladimir Putin",
        "terms": [["1999-12-31", "2000-05-07"], ["2000-05-07", "2008-05-07"], ["2012-05-07", null]]
    }, {
        "name": "Dmitry Medvedev",
        "href": "http://www.worldpresidentsdb.com/Dmitry-Medvedev/",
        "rawTerms": ["In office since 7th May 2008"],
        "titleName": "President Dmitry Medvedev",
        "terms": [["2008-05-07",null]]
    }],
    "Peru": [{
        "name": "Alan Garcia",
        "href": "http://www.worldpresidentsdb.com/Alan-Garcia/",
        "rawTerms": [" 1985-07-28 to 1990-07-28", " 2006-07-28 to 2011-07-28"],
        "titleName": "President Alan Garcia",
        "terms": [["1985-07-28", "1990-07-28"], ["2006-07-28", "2011-07-28"]]
    }, {
        "name": "Alberto Fujimori",
        "href": "http://www.worldpresidentsdb.com/Alberto-Fujimori/",
        "rawTerms": ["07/28/1990 to 07/28/1995\r\n07/28/1995 to 07/28/2000"],
        "titleName": "President Alberto Fujimori",
        "terms": [["1990-07-28", "1995-07-28"]]
    }, {
        "name": "Ollanta Humala",
        "href": "http://www.worldpresidentsdb.com/Ollanta-Humala/",
        "rawTerms": [" In office since 2011-07-28"],
        "titleName": "President Ollanta Humala",
        "terms": [["2011-07-28", null]]
    }],
    "Malaysia": [{
        "name": "Tunku Abdul Rahman",
        "href": "http://www.worldpresidentsdb.com/Tunku-Abdul-Rahman/",
        "rawTerms": [" 1957-08-31 to 1970-09-22"],
        "titleName": "Prime Minister Tunku Abdul Rahman",
        "terms": [["1957-08-31", "1970-09-22"]]
    }, {
        "name": "Abdul Razak Hussein",
        "href": "http://www.worldpresidentsdb.com/Abdul-Razak-Hussein/",
        "rawTerms": [" 1970-09-22 to 1976-01-14"],
        "titleName": "Prime Minister Abdul Razak Hussein",
        "terms": [["1970-09-22", "1976-01-14"]]
    }, {
        "name": "Hussein Onn",
        "href": "http://www.worldpresidentsdb.com/Hussein-Onn/",
        "rawTerms": [" 1976-01-15 to 1981-07-16"],
        "titleName": "Prime Minister Hussein Onn",
        "terms": [["1976-01-15", "1981-07-16"]]
    }, {
        "name": "Mahathir Mohamad",
        "href": "http://www.worldpresidentsdb.com/Mahathir-Mohamad/",
        "rawTerms": [" 1981-07-16 to 2003-10-31"],
        "titleName": "Prime Minister Mahathir Mohamad",
        "terms": [["1981-07-16", "2003-10-31"]]
    }, {
        "name": "Abdullah Ahmad Badawi",
        "href": "http://www.worldpresidentsdb.com/Abdullah-Ahmad-Badawi/",
        "rawTerms": [" 2003-10-31 to 2009-04-03"],
        "titleName": "Prime Minister Abdullah Ahmad Badawi",
        "terms": [["2003-10-31", "2009-04-03"]]
    }, {
        "name": "Najib Razak",
        "href": "http://www.worldpresidentsdb.com/Najib-Razak/",
        "rawTerms": [" 2009-04-03 to 2013-04-03", " In office since 2013-05-06"],
        "titleName": "Prime Minister Najib Razak",
        "terms": [["2009-04-03", "2013-04-03"], ["2013-05-06", null]]
    }],
    "Austria": [{
        "name": "Heinz Fischer",
        "href": "http://www.worldpresidentsdb.com/Heinz-Fischer/",
        "rawTerms": [" 2004-07-08 to 2010-07-08", " In office since 2010-07-08"],
        "titleName": "President Heinz Fischer",
        "terms": [["2004-07-08", "2010-07-08"], ["2010-07-08", null]]
    }, {
        "name": "Rudolf Kirchschlager",
        "href": "http://www.worldpresidentsdb.com/Rudolf-Kirchschlager/",
        "rawTerms": [" 1974-07-08 to 1980-07-08", " 1980-07-08 to 1986-07-08"],
        "titleName": "President Rudolf Kirchschlager",
        "terms": [["1974-07-08", "1980-07-08"], ["1980-07-08", "1986-07-08"]]
    }, {
        "name": "Thomas Klestil",
        "href": "http://www.worldpresidentsdb.com/Thomas-Klestil/",
        "rawTerms": [" 1998-07-08 to 2004-07-06", " 1992-07-08 to 1998-07-08"],
        "titleName": "President Thomas Klestil",
        "terms": [["1998-07-08", "2004-07-06"], ["1992-07-08", "1998-07-08"]]
    }, {
        "name": "Kurt Waldheim",
        "href": "http://www.worldpresidentsdb.com/Kurt-Waldheim/",
        "rawTerms": ["07/08/1986 to 07/08/1992"],
        "titleName": "President Kurt Waldheim",
        "terms": [["1986-07-08", "1992-07-08"]]
    }],
    "Vietnam": [{
        "name": "Tran Duc Luong",
        "href": "http://www.worldpresidentsdb.com/Tran-Duc-Luong/",
        "rawTerms": [" 1997-09-24 to 2006-06-26"],
        "titleName": "President Tran Duc Luong",
        "terms": [["1997-09-24", "2006-06-26"]]
    }, {
        "name": "Nguyen Minh Triet",
        "href": "http://www.worldpresidentsdb.com/Nguyen-Minh-Triet/",
        "rawTerms": [" 2006-06-27 to 2011-07-25"],
        "titleName": "Dictator Nguyen Minh Triet",
        "terms": [["2006-06-27", "2011-07-25"]]
    }, {
        "name": "Truong Tan Sang",
        "href": "http://www.worldpresidentsdb.com/Truong-Tan-Sang/",
        "rawTerms": [" In office since 2011-07-25"],
        "titleName": "President Truong Tan Sang",
        "terms": [["2011-07-25", null]]
    }],
    "United-States": [{
        "name": "George Washington",
        "href": "http://www.worldpresidentsdb.com/George-Washington/",
        "rawTerms": ["1st US President 04/30/1789 to 03/04/1797"],
        "titleName": "President George Washington",
        "terms": [["1789-04-30", "1797-03-04"]]
    }, {
        "name": "John Adams",
        "href": "http://www.worldpresidentsdb.com/John-Adams/",
        "rawTerms": [" 1797-03-04 to 1801-03-04"],
        "titleName": "President John Adams",
        "terms": [["1797-03-04", "1801-03-04"]]
    }, {
        "name": "Thomas Jefferson",
        "href": "http://www.worldpresidentsdb.com/Thomas-Jefferson/",
        "rawTerms": [" 1801-03-04 to 1805-03-04", " 1805-03-04 to 1809-03-04"],
        "titleName": "President Thomas Jefferson",
        "terms": [["1801-03-04", "1805-03-04"], ["1805-03-04", "1809-03-04"]]
    }, {
        "name": "James Madison",
        "href": "http://www.worldpresidentsdb.com/James-Madison/",
        "rawTerms": [" 1809-03-04 to 1813-03-04", " 1813-03-04 to 1817-03-04"],
        "titleName": "President James Madison",
        "terms": [["1809-03-04", "1813-03-04"], ["1813-03-04", "1817-03-04"]]
    }, {
        "name": "James Monroe",
        "href": "http://www.worldpresidentsdb.com/James-Monroe/",
        "rawTerms": [" 1817-03-04 to 1821-03-04", " 1821-03-04 to 1825-03-04"],
        "titleName": "President James Monroe",
        "terms": [["1817-03-04", "1821-03-04"], ["1821-03-04", "1825-03-04"]]
    }, {
        "name": "John Q Adams",
        "href": "http://www.worldpresidentsdb.com/John-Q-Adams/",
        "rawTerms": [" 1825-03-04 to 1829-03-04"],
        "titleName": "President John Q Adams",
        "terms": [["1825-03-04", "1829-03-04"]]
    }, {
        "name": "Andrew Jackson",
        "href": "http://www.worldpresidentsdb.com/Andrew-Jackson/",
        "rawTerms": [" 1829-03-04 to 1832-03-04", " 1832-03-04 to 1837-03-04"],
        "titleName": "President Andrew Jackson",
        "terms": [["1829-03-04", "1832-03-04"], ["1832-03-04", "1837-03-04"]]
    }, {
        "name": "Martin Van Buren",
        "href": "http://www.worldpresidentsdb.com/Martin-Van-Buren/",
        "rawTerms": ["8th US President 03/04/1837 to 03/04/1841"],
        "titleName": "President Martin Van Buren",
        "terms": [["1837-03-04", "1841-03-04"]]
    }, {
        "name": "William Henry Harrison",
        "href": "http://www.worldpresidentsdb.com/William-Henry-Harrison/",
        "rawTerms": [" 1841-03-04 to 1841-04-04"],
        "titleName": "President William Henry Harrison",
        "terms": [["1841-03-04", "1841-04-04"]]
    }, {
        "name": "John Tyler",
        "href": "http://www.worldpresidentsdb.com/John-Tyler/",
        "rawTerms": ["10th US President 04/04/1841 to 03/04/1845"],
        "titleName": "President John Tyler",
        "terms": [["1841-04-04", "1845-03-04"]]
    }, {
        "name": "James K Polk",
        "href": "http://www.worldpresidentsdb.com/James-K-Polk/",
        "rawTerms": ["11th US President 03/04/1845 to 03/04/1849"],
        "titleName": "President James K Polk",
        "terms": [["1845-03-04", "1849-03-04"]]
    }, {
        "name": "Zachary Taylor",
        "href": "http://www.worldpresidentsdb.com/Zachary-Taylor/",
        "rawTerms": ["12th US President 03/04/1849 to 07/09/1850"],
        "titleName": "President Zachary Taylor",
        "terms": [["1849-03-04", "1850-07-09"]]
    }, {
        "name": "Millard Fillmore",
        "href": "http://www.worldpresidentsdb.com/Millard-Fillmore/",
        "rawTerms": [" 1850-07-09 to 1853-03-04"],
        "titleName": "President Millard Fillmore",
        "terms": [["1850-07-09", "1853-03-04"]]
    }, {
        "name": "Franklin Pierce",
        "href": "http://www.worldpresidentsdb.com/Franklin-Pierce/",
        "rawTerms": ["14th US President 03/04/1853 to 03/04/1857"],
        "titleName": "President Franklin Pierce",
        "terms": [["1853-03-04", "1857-03-04"]]
    }, {
        "name": "James Buchanan",
        "href": "http://www.worldpresidentsdb.com/James-Buchanan/",
        "rawTerms": [" 1857-03-04 to 1861-03-04"],
        "titleName": "President James Buchanan",
        "terms": [["1857-03-04", "1861-03-04"]]
    }, {
        "name": "Lincoln",
        "href": "http://www.worldpresidentsdb.com/Lincoln/",
        "rawTerms": [" 1861-03-04 to 1865-04-15"],
        "titleName": "President Lincoln",
        "terms": [["1861-03-04", "1865-04-15"]]
    }, {
        "name": "Andrew Johnson",
        "href": "http://www.worldpresidentsdb.com/Andrew-Johnson/",
        "rawTerms": [" 1865-04-15 to 1869-03-04"],
        "titleName": "President Andrew Johnson",
        "terms": [["1865-04-15", "1869-03-04"]]
    }, {
        "name": "Ulysses S Grant",
        "href": "http://www.worldpresidentsdb.com/Ulysses-S-Grant/",
        "rawTerms": [" 1869-03-04 to 1873-03-04", " 1873-03-04 to 1877-03-04"],
        "titleName": "President Ulysses S Grant",
        "terms": [["1869-03-04", "1873-03-04"], ["1873-03-04", "1877-03-04"]]
    }, {
        "name": "Rutherford B Hayes",
        "href": "http://www.worldpresidentsdb.com/Rutherford-B-Hayes/",
        "rawTerms": [" 1877-03-04 to 1881-03-04"],
        "titleName": "President Rutherford B Hayes",
        "terms": [["1877-03-04", "1881-03-04"]]
    }, {
        "name": "James A Garfield",
        "href": "http://www.worldpresidentsdb.com/James-A-Garfield/",
        "rawTerms": [" 1881-03-04 to 1881-09-19"],
        "titleName": "President James A Garfield",
        "terms": [["1881-03-04", "1881-09-19"]]
    }, {
        "name": "Chester A Arthur",
        "href": "http://www.worldpresidentsdb.com/Chester-A-Arthur/",
        "rawTerms": [" 1881-09-19 to 1885-03-04"],
        "titleName": "President Chester A Arthur",
        "terms": [["1881-09-19", "1885-03-04"]]
    }, {
        "name": "Grover Cleveland",
        "href": "http://www.worldpresidentsdb.com/Grover-Cleveland/",
        "rawTerms": [" 1885-03-04 to 1889-03-04", " 1893-03-04 to 1897-03-04"],
        "titleName": "President Grover Cleveland",
        "terms": [["1885-03-04", "1889-03-04"], ["1893-03-04", "1897-03-04"]]
    }, {
        "name": "Benjamin Harrison",
        "href": "http://www.worldpresidentsdb.com/Benjamin-Harrison/",
        "rawTerms": [" 1889-03-04 to 1893-03-04"],
        "titleName": "President Benjamin Harrison",
        "terms": [["1889-03-04", "1893-03-04"]]
    }, {
        "name": "William McKinley",
        "href": "http://www.worldpresidentsdb.com/William-McKinley/",
        "rawTerms": [" 1897-03-04 to 1901-09-14"],
        "titleName": "President William McKinley",
        "terms": [["1897-03-04", "1901-09-14"]]
    }, {
        "name": "Theodore Roosevelt",
        "href": "http://www.worldpresidentsdb.com/Theodore-Roosevelt/",
        "rawTerms": ["26th US President 09/14/1901 to 03/04/1909"],
        "titleName": "President Theodore Roosevelt",
        "terms": [["1901-09-14", "1909-03-04"]]
    }, {
        "name": "William Howard Taft",
        "href": "http://www.worldpresidentsdb.com/William-Howard-Taft/",
        "rawTerms": ["27th US President 03/04/1909 to 03/04/1913"],
        "titleName": "President William Howard Taft",
        "terms": [["1909-03-04", "1913-03-04"]]
    }, {
        "name": "Woodrow Wilson",
        "href": "http://www.worldpresidentsdb.com/Woodrow-Wilson/",
        "rawTerms": [" 1913-04-03 to 1917-04-03", " 1917-04-03 to 1921-04-03"],
        "titleName": "President Woodrow Wilson",
        "terms": [["1913-04-03", "1917-04-03"], ["1917-04-03", "1921-04-03"]]
    }, {
        "name": "Warren G Harding",
        "href": "http://www.worldpresidentsdb.com/Warren-G-Harding/",
        "rawTerms": [" 1921-03-04 to 1923-08-02"],
        "titleName": "President Warren G Harding",
        "terms": [["1921-03-04", "1923-08-02"]]
    }, {
        "name": "Calvin Coolidge",
        "href": "http://www.worldpresidentsdb.com/Calvin-Coolidge/",
        "rawTerms": [" 1923-08-02 to 1925-03-04", " 1925-03-04 to 1929-03-04"],
        "titleName": "President Calvin Coolidge",
        "terms": [["1923-08-02", "1925-03-04"], ["1925-03-04", "1929-03-04"]]
    }, {
        "name": "Herbert Hoover",
        "href": "http://www.worldpresidentsdb.com/Herbert-Hoover/",
        "rawTerms": [" 1929-03-04 to 1933-03-04"],
        "titleName": "President Herbert Hoover",
        "terms": [["1929-03-04", "1933-03-04"]]
    }, {
        "name": "Franklin D Roosevelt",
        "href": "http://www.worldpresidentsdb.com/Franklin-D-Roosevelt/",
        "rawTerms": ["32th US President 03/04/1933 to 04/12/1945"],
        "titleName": "President Franklin D Roosevelt",
        "terms": [["1933-03-04", "1945-04-12"]]
    }, {
        "name": "Truman",
        "href": "http://www.worldpresidentsdb.com/Truman/",
        "rawTerms": ["33th US President 04/12/1945 to 01/20/1953"],
        "titleName": "President Truman",
        "terms": [["1945-04-12", "1953-01-20"]]
    }, {
        "name": "Eisenhower",
        "href": "http://www.worldpresidentsdb.com/Eisenhower/",
        "rawTerms": [" 1953-01-20 to 1957-01-20", " 1957-01-20 to 1961-01-20"],
        "titleName": "President Eisenhower",
        "terms": [["1953-01-20", "1957-01-20"], ["1957-01-20", "1961-01-20"]]
    }, {
        "name": "Kennedy",
        "href": "http://www.worldpresidentsdb.com/Kennedy/",
        "rawTerms": [" 1961-01-20 to 1963-11-22"],
        "titleName": "President Kennedy",
        "terms": [["1961-01-20", "1963-11-22"]]
    }, {
        "name": "Lyndon B Johnson",
        "href": "http://www.worldpresidentsdb.com/Lyndon-B-Johnson/",
        "rawTerms": [" 1963-11-22 to 1965-01-20", " 1965-01-20 to 1969-01-20"],
        "titleName": "President Lyndon B Johnson",
        "terms": [["1963-11-22", "1965-01-20"], ["1965-01-20", "1969-01-20"]]
    }, {
        "name": "Nixon",
        "href": "http://www.worldpresidentsdb.com/Nixon/",
        "rawTerms": ["37th US President 01/20/1969 to 08/09/1974"],
        "titleName": "President Nixon",
        "terms": [["1969-01-20", "1974-08-09"]]
    }, {
        "name": "Gerald Ford",
        "href": "http://www.worldpresidentsdb.com/Gerald-Ford/",
        "rawTerms": [" 1974-08-09 to 1977-01-20"],
        "titleName": "President Gerald Ford",
        "terms": [["1974-08-09", "1977-01-20"]]
    }, {
        "name": "Jimmy Carter",
        "href": "http://www.worldpresidentsdb.com/Jimmy-Carter/",
        "rawTerms": [" 1977-01-20 to 1981-01-20"],
        "titleName": "President Jimmy Carter",
        "terms": [["1977-01-20", "1981-01-20"]]
    }, {
        "name": "Reagan",
        "href": "http://www.worldpresidentsdb.com/Reagan/",
        "rawTerms": ["40th US President 01/20/1981 to 01/20/1989"],
        "titleName": "President Reagan",
        "terms": [["1981-01-20", "1989-01-20"]]
    }, {
        "name": "George H W Bush",
        "href": "http://www.worldpresidentsdb.com/George-H-W-Bush/",
        "rawTerms": [" 1989-01-20 to 1993-01-20"],
        "titleName": "President George H W Bush",
        "terms": [["1989-01-20", "1993-01-20"]]
    }, {
        "name": "Bill Clinton",
        "href": "http://www.worldpresidentsdb.com/Bill-Clinton/",
        "rawTerms": [" 1993-01-20 to 1997-01-20", " 1997-01-20 to 2001-01-20"],
        "titleName": "President Bill Clinton",
        "terms": [["1993-01-20", "1997-01-20"], ["1997-01-20", "2001-01-20"]]
    }, {
        "name": "George W Bush",
        "href": "http://www.worldpresidentsdb.com/George-W-Bush/",
        "rawTerms": [" 2001-01-20 to 2005-01-20", " 2005-01-20 to 2009-01-20"],
        "titleName": "President George W Bush",
        "terms": [["2001-01-20", "2005-01-20"], ["2005-01-20", "2009-01-20"]]
    }, {
        "name": "Barack Obama",
        "href": "http://www.worldpresidentsdb.com/Barack-Obama/",
        "rawTerms": [" In office since 2009-01-20"],
        "titleName": "President Barack Obama",
        "terms": [["2009-01-20", null]]
    }],
    "Colombia": [{
        "name": "Cesar Gaviria",
        "href": "http://www.worldpresidentsdb.com/Cesar-Gaviria/",
        "rawTerms": [" 1990-08-07 to 1994-08-07"],
        "titleName": "President Cesar Gaviria",
        "terms": [["1990-08-07", "1994-08-07"]]
    }, {
        "name": "Andres Pastrana Arango",
        "href": "http://www.worldpresidentsdb.com/Andres-Pastrana-Arango/",
        "rawTerms": ["08/07/1998 to 08/07/2002"],
        "titleName": "President Andres Pastrana Arango",
        "terms": [["1998-08-07", "2002-08-07"]]
    }, {
        "name": "Ernesto Samper",
        "href": "http://www.worldpresidentsdb.com/Ernesto-Samper/",
        "rawTerms": ["08/07/1994 to 08/07/1998"],
        "titleName": "President Ernesto Samper",
        "terms": [["1994-08-07", "1998-08-07"]]
    }, {
        "name": "Juan Manuel Santos",
        "href": "http://www.worldpresidentsdb.com/Juan-Manuel-Santos/",
        "rawTerms": [" In office since 2010-08-07"],
        "titleName": "President Juan Manuel Santos",
        "terms": [["2010-08-07", null]]
    }, {
        "name": "Alvaro Uribe",
        "href": "http://www.worldpresidentsdb.com/Alvaro-Uribe/",
        "rawTerms": [" 2002-08-07 to 2006-08-07", " 2006-08-07 to 2010-08-07"],
        "titleName": "President Alvaro Uribe",
        "terms": [["2002-08-07", "2006-08-07"], ["2006-08-07", "2010-08-07"]]
    }],
    "Greece": [{
        "name": "Konstantinos Karamanlis",
        "href": "http://www.worldpresidentsdb.com/Konstantinos-Karamanlis/",
        "rawTerms": [" 1990-05-05 to 1995-05-10", " 1980-05-15 to 1985-03-10"],
        "titleName": "President Konstantinos Karamanlis",
        "terms": [["1990-05-05", "1995-05-10"], ["1980-05-15", "1985-03-10"]]
    }, {
        "name": "Konstantinos Stephanopoulos",
        "href": "http://www.worldpresidentsdb.com/Konstantinos-Stephanopoulos/",
        "rawTerms": [" 1995-03-10 to 2005-03-12"],
        "titleName": "President Konstantinos Stephanopoulos",
        "terms": [["1995-03-10", "2005-03-12"]]
    }, {
        "name": "Karolos Papoulias",
        "href": "http://www.worldpresidentsdb.com/Karolos-Papoulias/",
        "rawTerms": [" In office since 2005-03-12"],
        "titleName": "President Karolos Papoulias",
        "terms": [["2005-03-12", null]]
    }],
    "Paraguay": [{
        "name": "Horacio Cartes",
        "href": "http://www.worldpresidentsdb.com/Horacio-Cartes/",
        "rawTerms": [" In office since 2013-08-15"],
        "titleName": "President Horacio Cartes",
        "terms": [["2013-08-15", null]]
    }, {
        "name": "Nicanor Duarte",
        "href": "http://www.worldpresidentsdb.com/Nicanor-Duarte/",
        "rawTerms": [" 2003-08-15 to 2008-08-14"],
        "titleName": "President Nicanor Duarte",
        "terms": [["2003-08-15", "2008-08-14"]]
    }, {
        "name": "Federico Franco",
        "href": "http://www.worldpresidentsdb.com/Federico-Franco/",
        "rawTerms": [" 2012-06-22 to 2013-08-15"],
        "titleName": "President Federico Franco",
        "terms": [["2012-06-22", "2013-08-15"]]
    }, {
        "name": "Luis Angel Gonzalez Macchi",
        "href": "http://www.worldpresidentsdb.com/Luis-Angel-Gonzalez-Macchi/",
        "rawTerms": ["03/29/1999 to 08/15/2003"],
        "titleName": "President Luis Angel Gonzalez Macchi",
        "terms": [["1999-03-29", "2003-08-15"]]
    }],
    "Croatia": [{
        "name": "Franjo Tudman",
        "href": "http://www.worldpresidentsdb.com/Franjo-Tudman/",
        "rawTerms": [" 1990-05-30 to 1999-12-10"],
        "titleName": "President Franjo Tudman",
        "terms": [["1990-05-30", "1999-12-10"]]
    }, {
        "name": "Stjepan Mesic",
        "href": "http://www.worldpresidentsdb.com/Stjepan-Mesic/",
        "rawTerms": [" 2000-02-19 to 2010-02-19"],
        "titleName": "President Stjepan Mesic",
        "terms": [["2000-02-19", "2010-02-19"]]
    }, {
        "name": "Ivo Josipovic",
        "href": "http://www.worldpresidentsdb.com/Ivo-Josipovic/",
        "rawTerms": [" In office since 2010-02-19"],
        "titleName": "President Ivo Josipovic",
        "terms": [["2010-02-19", null]]
    }],
    "Nicaragua": [{
        "name": "Daniel Ortega",
        "href": "http://www.worldpresidentsdb.com/Daniel-Ortega/",
        "rawTerms": [" 1985-01-10 to 1990-04-25", " In office since 2007-01-10"],
        "titleName": "President Daniel Ortega",
        "terms": [["1985-01-10", "1990-04-25"], ["2007-01-10", null]]
    }]
}